Name,Scholar Link,DOI,Bibtex,PDF Name,Year,Scholar page,Journal,Downloaded,Downloaded from,Authors
"A common mutation in the 5, 10-methylenetetrahydrofolate reductase gene affects genomic DNA methylation through an interaction with folate status",https://www.pnas.org/doi/abs/10.1073/pnas.062066299,10.1073/pnas.062066299,True,A common mutation in the 5_ 10-methylenetetrahydrofolate reductase gene affects genomic DNA methylation through an interaction with folate status.pdf,2002,"https://scholar.google.com/scholar?hl=en&as_vis=1&as_sdt=1,5&start=%d&q=(Methyl OR Epigenetic OR Methylation OR Magic methyl OR Methylmercury OR 5-Methylcytosine OR 5-methylcytosine OR Methyllithium OR DNA methylation OR Methyl group OR Epigenetics OR 5-methyltetrahydrofolate OR N6-Methyladenosine OR FKBP5 OR Methylamine OR Demethylase OR Protein methylation OR H3K27me3 OR Epigenomics OR Methyl lithium OR Methyl ether OR 5-O-Methylmyricetin OR 5-O-Methylgenistein OR Mercury methylation OR 5-O-Methylquercetin OR Demethylation OR Carbonyl OR O-methylation OR Purdie methylation OR Ketone OR Histone methyltransferase OR Histone OR Butyrylation OR Methyl triflate OR RRNA OR Dimethylzinc OR Methylmagnesium bromide OR Acetone OR DNA methyltransferase OR BrCN OR Dimethylformamide OR Bromide OR Child abuse OR Amine OR N-methylpyridinium chloride OR Hydrochloride OR Pyridine OR Acylation OR Dimethyl carbonate OR Pyridinium) AND (Depression OR PTSD OR Traumatic stress OR Anxiety OR Mood disorder OR Psychological stress OR Mental disorder OR Mood disorders OR Chronic stress OR Mental health OR Suicide OR Post-traumatic stress disorder OR Depression and Anxiety OR Major depression OR Psychological trauma OR Atypical depression OR Clinical depression OR Bipolar OR Psychiatry OR Bipolar disorder OR Acute stress disorder OR Long Depression OR Traumatic memories OR Anxiety disorder OR Major depressive disorder OR Post Traumatic OR Post traumatic OR Panic disorder OR Psychological Medicine OR Melancholic depression OR Complex post-traumatic stress disorder OR Emotional and behavioral disorders OR Personality disorder OR Bipolar I disorder OR Post-traumatic embitterment disorder OR Great Depression OR Self-harm OR Psychogenic pain OR Generalized anxiety disorder OR Combat Stress OR Social anxiety OR Dissociative disorder OR Psychosis OR Bipolar violation OR Major trauma OR Psychogenic amnesia OR Delusional disorder OR Psychological resilience OR Biological Psychiatry OR Post-traumatic stress disorder and substance use disorders) AND (African American OR African Americans OR Negro OR Negroid OR Afro-Arab OR Blacks OR Black people OR African-American history OR Afro-Asians OR Afro-Latin American OR Hispanic OR Hispanic American OR Hispanics OR Latinos OR Hispanic America OR Hispanic and Latino OR Hispanic and Latino Americans OR Hispanic culture OR Mexican American OR Black Hispanic and Latino Americans OR South Asian OR Asian people OR East Asian people OR East Asian Americans OR Southeast Asian Americans OR Asian Americans OR South Asian Americans OR East Asians OR British Asian OR Asian Pacific American OR Indigenous peoples OR Indigenous peoples of the Americas OR Indigenous peoples of Africa OR Indigenous peoples of North America OR List of indigenous peoples OR List of Indigenous peoples OR Indigenous peoples in Canada OR Indigenous peoples of Eurasia OR Native Americans in the United States OR Indigenous studies OR Arab OR Arab people OR Arab Muslims OR Arab Americans OR Afro-Arab OR Arab identity OR Arabs OR Arab Malaysians OR Arabah OR Arab Canadians OR White ethnic OR White Americans OR Caucasian race OR White British OR European Americans OR White Latin American OR Nationality OR Ethnicity OR White Latin Americans OR White people OR Poverty OR Concentrated poverty OR Extreme poverty OR Relative poverty OR Asset poverty OR Poverty reduction OR Absolute poverty OR Poverty threshold OR Poverty alleviation OR Global poverty OR Poverty line OR The End of Poverty OR Poverty in the United States OR Working poor OR Secondary poverty OR Chronic poverty OR Child poverty OR Income disparity OR Rural poverty OR Lower middle class OR Measuring poverty OR Disadvantaged OR Poverty in North America OR Poverty in the Americas OR Fuel poverty OR Poor OR Relational poverty OR Poverty in the United Kingdom OR Poverty in Switzerland OR Poverty in Europe OR Poverty in the Comoros OR Causes of poverty OR Human Poverty Index OR Prosperity OR Cycle of poverty OR Poverty in Australia OR Theories of poverty OR Poverty in Northern America OR Poverty in Asia OR Basic income OR Poverty in Sweden OR Poverty in South Africa OR Poverty in the European Economic Area OR Poverty in Africa OR Poverty in South Ossetia OR Poverty in Central America OR Poverty in Bonaire OR Poverty in Jersey OR Poverty in South Korea OR Poverty in Latin America)&as_ylo=2000",Proceedings of the National Academy of Sciences,True,SciDB,"Friso, Simonetta and Choi, Sang-Woon and Girelli, Domenico and Mason, Joel B. and Dolnikowski, Gregory G. and Bagley, Pamela J. and Olivieri, Oliviero and Jacques, Paul F. and Rosenberg, Irwin H. and Corrocher, Roberto and Selhub, Jacob"
iN6-Methyl (5-step): Identifying RNA N6-methyladenosine sites using deep learning mode via Chou's 5-step rules and Chou's general PseKNC,https://www.sciencedirect.com/science/article/pii/S0169743919300838,10.1016/j.chemolab.2019.103811,True,iN6-Methyl _5-step__ Identifying RNA N6-methyladenosine sites using deep learning mode via Chou_s 5-step rules and Chou_s general PseKNC.pdf,2019,"https://scholar.google.com/scholar?hl=en&as_vis=1&as_sdt=1,5&start=%d&q=(Methyl OR Epigenetic OR Methylation OR Magic methyl OR Methylmercury OR 5-Methylcytosine OR 5-methylcytosine OR Methyllithium OR DNA methylation OR Methyl group OR Epigenetics OR 5-methyltetrahydrofolate OR N6-Methyladenosine OR FKBP5 OR Methylamine OR Demethylase OR Protein methylation OR H3K27me3 OR Epigenomics OR Methyl lithium OR Methyl ether OR 5-O-Methylmyricetin OR 5-O-Methylgenistein OR Mercury methylation OR 5-O-Methylquercetin OR Demethylation OR Carbonyl OR O-methylation OR Purdie methylation OR Ketone OR Histone methyltransferase OR Histone OR Butyrylation OR Methyl triflate OR RRNA OR Dimethylzinc OR Methylmagnesium bromide OR Acetone OR DNA methyltransferase OR BrCN OR Dimethylformamide OR Bromide OR Child abuse OR Amine OR N-methylpyridinium chloride OR Hydrochloride OR Pyridine OR Acylation OR Dimethyl carbonate OR Pyridinium) AND (Depression OR PTSD OR Traumatic stress OR Anxiety OR Mood disorder OR Psychological stress OR Mental disorder OR Mood disorders OR Chronic stress OR Mental health OR Suicide OR Post-traumatic stress disorder OR Depression and Anxiety OR Major depression OR Psychological trauma OR Atypical depression OR Clinical depression OR Bipolar OR Psychiatry OR Bipolar disorder OR Acute stress disorder OR Long Depression OR Traumatic memories OR Anxiety disorder OR Major depressive disorder OR Post Traumatic OR Post traumatic OR Panic disorder OR Psychological Medicine OR Melancholic depression OR Complex post-traumatic stress disorder OR Emotional and behavioral disorders OR Personality disorder OR Bipolar I disorder OR Post-traumatic embitterment disorder OR Great Depression OR Self-harm OR Psychogenic pain OR Generalized anxiety disorder OR Combat Stress OR Social anxiety OR Dissociative disorder OR Psychosis OR Bipolar violation OR Major trauma OR Psychogenic amnesia OR Delusional disorder OR Psychological resilience OR Biological Psychiatry OR Post-traumatic stress disorder and substance use disorders) AND (African American OR African Americans OR Negro OR Negroid OR Afro-Arab OR Blacks OR Black people OR African-American history OR Afro-Asians OR Afro-Latin American OR Hispanic OR Hispanic American OR Hispanics OR Latinos OR Hispanic America OR Hispanic and Latino OR Hispanic and Latino Americans OR Hispanic culture OR Mexican American OR Black Hispanic and Latino Americans OR South Asian OR Asian people OR East Asian people OR East Asian Americans OR Southeast Asian Americans OR Asian Americans OR South Asian Americans OR East Asians OR British Asian OR Asian Pacific American OR Indigenous peoples OR Indigenous peoples of the Americas OR Indigenous peoples of Africa OR Indigenous peoples of North America OR List of indigenous peoples OR List of Indigenous peoples OR Indigenous peoples in Canada OR Indigenous peoples of Eurasia OR Native Americans in the United States OR Indigenous studies OR Arab OR Arab people OR Arab Muslims OR Arab Americans OR Afro-Arab OR Arab identity OR Arabs OR Arab Malaysians OR Arabah OR Arab Canadians OR White ethnic OR White Americans OR Caucasian race OR White British OR European Americans OR White Latin American OR Nationality OR Ethnicity OR White Latin Americans OR White people OR Poverty OR Concentrated poverty OR Extreme poverty OR Relative poverty OR Asset poverty OR Poverty reduction OR Absolute poverty OR Poverty threshold OR Poverty alleviation OR Global poverty OR Poverty line OR The End of Poverty OR Poverty in the United States OR Working poor OR Secondary poverty OR Chronic poverty OR Child poverty OR Income disparity OR Rural poverty OR Lower middle class OR Measuring poverty OR Disadvantaged OR Poverty in North America OR Poverty in the Americas OR Fuel poverty OR Poor OR Relational poverty OR Poverty in the United Kingdom OR Poverty in Switzerland OR Poverty in Europe OR Poverty in the Comoros OR Causes of poverty OR Human Poverty Index OR Prosperity OR Cycle of poverty OR Poverty in Australia OR Theories of poverty OR Poverty in Northern America OR Poverty in Asia OR Basic income OR Poverty in Sweden OR Poverty in South Africa OR Poverty in the European Economic Area OR Poverty in Africa OR Poverty in South Ossetia OR Poverty in Central America OR Poverty in Bonaire OR Poverty in Jersey OR Poverty in South Korea OR Poverty in Latin America)&as_ylo=2000",Chemometrics and Intelligent Laboratory Systems,True,SciDB,"Nazari, Iman and Tahir, Muhammad and Tayara, Hilal and Chong, Kil To"
Intrathecal 5-azacytidine inhibits global DNA methylation and methyl-CpG-binding protein 2 expression and alleviates neuropathic pain in rats following chronic …,https://www.sciencedirect.com/science/article/pii/S0006899311015459,10.1016/j.brainres.2011.08.040,True,Intrathecal 5-azacytidine inhibits global DNA methylation and methyl-CpG-binding protein 2 expression and alleviates neuropathic pain in rats following chronic__.pdf,2011,"https://scholar.google.com/scholar?hl=en&as_vis=1&as_sdt=1,5&start=%d&q=(Methyl OR Epigenetic OR Methylation OR Magic methyl OR Methylmercury OR 5-Methylcytosine OR 5-methylcytosine OR Methyllithium OR DNA methylation OR Methyl group OR Epigenetics OR 5-methyltetrahydrofolate OR N6-Methyladenosine OR FKBP5 OR Methylamine OR Demethylase OR Protein methylation OR H3K27me3 OR Epigenomics OR Methyl lithium OR Methyl ether OR 5-O-Methylmyricetin OR 5-O-Methylgenistein OR Mercury methylation OR 5-O-Methylquercetin OR Demethylation OR Carbonyl OR O-methylation OR Purdie methylation OR Ketone OR Histone methyltransferase OR Histone OR Butyrylation OR Methyl triflate OR RRNA OR Dimethylzinc OR Methylmagnesium bromide OR Acetone OR DNA methyltransferase OR BrCN OR Dimethylformamide OR Bromide OR Child abuse OR Amine OR N-methylpyridinium chloride OR Hydrochloride OR Pyridine OR Acylation OR Dimethyl carbonate OR Pyridinium) AND (Depression OR PTSD OR Traumatic stress OR Anxiety OR Mood disorder OR Psychological stress OR Mental disorder OR Mood disorders OR Chronic stress OR Mental health OR Suicide OR Post-traumatic stress disorder OR Depression and Anxiety OR Major depression OR Psychological trauma OR Atypical depression OR Clinical depression OR Bipolar OR Psychiatry OR Bipolar disorder OR Acute stress disorder OR Long Depression OR Traumatic memories OR Anxiety disorder OR Major depressive disorder OR Post Traumatic OR Post traumatic OR Panic disorder OR Psychological Medicine OR Melancholic depression OR Complex post-traumatic stress disorder OR Emotional and behavioral disorders OR Personality disorder OR Bipolar I disorder OR Post-traumatic embitterment disorder OR Great Depression OR Self-harm OR Psychogenic pain OR Generalized anxiety disorder OR Combat Stress OR Social anxiety OR Dissociative disorder OR Psychosis OR Bipolar violation OR Major trauma OR Psychogenic amnesia OR Delusional disorder OR Psychological resilience OR Biological Psychiatry OR Post-traumatic stress disorder and substance use disorders) AND (African American OR African Americans OR Negro OR Negroid OR Afro-Arab OR Blacks OR Black people OR African-American history OR Afro-Asians OR Afro-Latin American OR Hispanic OR Hispanic American OR Hispanics OR Latinos OR Hispanic America OR Hispanic and Latino OR Hispanic and Latino Americans OR Hispanic culture OR Mexican American OR Black Hispanic and Latino Americans OR South Asian OR Asian people OR East Asian people OR East Asian Americans OR Southeast Asian Americans OR Asian Americans OR South Asian Americans OR East Asians OR British Asian OR Asian Pacific American OR Indigenous peoples OR Indigenous peoples of the Americas OR Indigenous peoples of Africa OR Indigenous peoples of North America OR List of indigenous peoples OR List of Indigenous peoples OR Indigenous peoples in Canada OR Indigenous peoples of Eurasia OR Native Americans in the United States OR Indigenous studies OR Arab OR Arab people OR Arab Muslims OR Arab Americans OR Afro-Arab OR Arab identity OR Arabs OR Arab Malaysians OR Arabah OR Arab Canadians OR White ethnic OR White Americans OR Caucasian race OR White British OR European Americans OR White Latin American OR Nationality OR Ethnicity OR White Latin Americans OR White people OR Poverty OR Concentrated poverty OR Extreme poverty OR Relative poverty OR Asset poverty OR Poverty reduction OR Absolute poverty OR Poverty threshold OR Poverty alleviation OR Global poverty OR Poverty line OR The End of Poverty OR Poverty in the United States OR Working poor OR Secondary poverty OR Chronic poverty OR Child poverty OR Income disparity OR Rural poverty OR Lower middle class OR Measuring poverty OR Disadvantaged OR Poverty in North America OR Poverty in the Americas OR Fuel poverty OR Poor OR Relational poverty OR Poverty in the United Kingdom OR Poverty in Switzerland OR Poverty in Europe OR Poverty in the Comoros OR Causes of poverty OR Human Poverty Index OR Prosperity OR Cycle of poverty OR Poverty in Australia OR Theories of poverty OR Poverty in Northern America OR Poverty in Asia OR Basic income OR Poverty in Sweden OR Poverty in South Africa OR Poverty in the European Economic Area OR Poverty in Africa OR Poverty in South Ossetia OR Poverty in Central America OR Poverty in Bonaire OR Poverty in Jersey OR Poverty in South Korea OR Poverty in Latin America)&as_ylo=2000",Brain Research,True,SciDB,"Wang, Ying and Liu, Chang and Guo, Qu-Lian and Yan, Jian-Qin and Zhu, Xiao-Yan and Huang, Chang-Sheng and Zou, Wang-Yuan"
Folate and DNA methylation: a review of molecular mechanisms and the evidence for folate's role,https://www.sciencedirect.com/science/article/pii/S2161831322009644,10.3945/an.111.000992,True,Folate and DNA methylation_ a review of molecular mechanisms and the evidence for folate_s role.pdf,2012,"https://scholar.google.com/scholar?hl=en&as_vis=1&as_sdt=1,5&start=%d&q=(Methyl OR Epigenetic OR Methylation OR Magic methyl OR Methylmercury OR 5-Methylcytosine OR 5-methylcytosine OR Methyllithium OR DNA methylation OR Methyl group OR Epigenetics OR 5-methyltetrahydrofolate OR N6-Methyladenosine OR FKBP5 OR Methylamine OR Demethylase OR Protein methylation OR H3K27me3 OR Epigenomics OR Methyl lithium OR Methyl ether OR 5-O-Methylmyricetin OR 5-O-Methylgenistein OR Mercury methylation OR 5-O-Methylquercetin OR Demethylation OR Carbonyl OR O-methylation OR Purdie methylation OR Ketone OR Histone methyltransferase OR Histone OR Butyrylation OR Methyl triflate OR RRNA OR Dimethylzinc OR Methylmagnesium bromide OR Acetone OR DNA methyltransferase OR BrCN OR Dimethylformamide OR Bromide OR Child abuse OR Amine OR N-methylpyridinium chloride OR Hydrochloride OR Pyridine OR Acylation OR Dimethyl carbonate OR Pyridinium) AND (Depression OR PTSD OR Traumatic stress OR Anxiety OR Mood disorder OR Psychological stress OR Mental disorder OR Mood disorders OR Chronic stress OR Mental health OR Suicide OR Post-traumatic stress disorder OR Depression and Anxiety OR Major depression OR Psychological trauma OR Atypical depression OR Clinical depression OR Bipolar OR Psychiatry OR Bipolar disorder OR Acute stress disorder OR Long Depression OR Traumatic memories OR Anxiety disorder OR Major depressive disorder OR Post Traumatic OR Post traumatic OR Panic disorder OR Psychological Medicine OR Melancholic depression OR Complex post-traumatic stress disorder OR Emotional and behavioral disorders OR Personality disorder OR Bipolar I disorder OR Post-traumatic embitterment disorder OR Great Depression OR Self-harm OR Psychogenic pain OR Generalized anxiety disorder OR Combat Stress OR Social anxiety OR Dissociative disorder OR Psychosis OR Bipolar violation OR Major trauma OR Psychogenic amnesia OR Delusional disorder OR Psychological resilience OR Biological Psychiatry OR Post-traumatic stress disorder and substance use disorders) AND (African American OR African Americans OR Negro OR Negroid OR Afro-Arab OR Blacks OR Black people OR African-American history OR Afro-Asians OR Afro-Latin American OR Hispanic OR Hispanic American OR Hispanics OR Latinos OR Hispanic America OR Hispanic and Latino OR Hispanic and Latino Americans OR Hispanic culture OR Mexican American OR Black Hispanic and Latino Americans OR South Asian OR Asian people OR East Asian people OR East Asian Americans OR Southeast Asian Americans OR Asian Americans OR South Asian Americans OR East Asians OR British Asian OR Asian Pacific American OR Indigenous peoples OR Indigenous peoples of the Americas OR Indigenous peoples of Africa OR Indigenous peoples of North America OR List of indigenous peoples OR List of Indigenous peoples OR Indigenous peoples in Canada OR Indigenous peoples of Eurasia OR Native Americans in the United States OR Indigenous studies OR Arab OR Arab people OR Arab Muslims OR Arab Americans OR Afro-Arab OR Arab identity OR Arabs OR Arab Malaysians OR Arabah OR Arab Canadians OR White ethnic OR White Americans OR Caucasian race OR White British OR European Americans OR White Latin American OR Nationality OR Ethnicity OR White Latin Americans OR White people OR Poverty OR Concentrated poverty OR Extreme poverty OR Relative poverty OR Asset poverty OR Poverty reduction OR Absolute poverty OR Poverty threshold OR Poverty alleviation OR Global poverty OR Poverty line OR The End of Poverty OR Poverty in the United States OR Working poor OR Secondary poverty OR Chronic poverty OR Child poverty OR Income disparity OR Rural poverty OR Lower middle class OR Measuring poverty OR Disadvantaged OR Poverty in North America OR Poverty in the Americas OR Fuel poverty OR Poor OR Relational poverty OR Poverty in the United Kingdom OR Poverty in Switzerland OR Poverty in Europe OR Poverty in the Comoros OR Causes of poverty OR Human Poverty Index OR Prosperity OR Cycle of poverty OR Poverty in Australia OR Theories of poverty OR Poverty in Northern America OR Poverty in Asia OR Basic income OR Poverty in Sweden OR Poverty in South Africa OR Poverty in the European Economic Area OR Poverty in Africa OR Poverty in South Ossetia OR Poverty in Central America OR Poverty in Bonaire OR Poverty in Jersey OR Poverty in South Korea OR Poverty in Latin America)&as_ylo=2000",Advances in Nutrition,True,SciDB,"Crider, Krista S. and Yang, Thomas P. and Berry, Robert J and Bailey, Lynn B."
DNA methylation and its basic function,https://www.nature.com/articles/npp2012112,10.1038/npp.2012.112,True,DNA methylation and its basic function.pdf,2012,"https://scholar.google.com/scholar?hl=en&as_vis=1&as_sdt=1,5&start=%d&q=(Methyl OR Epigenetic OR Methylation OR Magic methyl OR Methylmercury OR 5-Methylcytosine OR 5-methylcytosine OR Methyllithium OR DNA methylation OR Methyl group OR Epigenetics OR 5-methyltetrahydrofolate OR N6-Methyladenosine OR FKBP5 OR Methylamine OR Demethylase OR Protein methylation OR H3K27me3 OR Epigenomics OR Methyl lithium OR Methyl ether OR 5-O-Methylmyricetin OR 5-O-Methylgenistein OR Mercury methylation OR 5-O-Methylquercetin OR Demethylation OR Carbonyl OR O-methylation OR Purdie methylation OR Ketone OR Histone methyltransferase OR Histone OR Butyrylation OR Methyl triflate OR RRNA OR Dimethylzinc OR Methylmagnesium bromide OR Acetone OR DNA methyltransferase OR BrCN OR Dimethylformamide OR Bromide OR Child abuse OR Amine OR N-methylpyridinium chloride OR Hydrochloride OR Pyridine OR Acylation OR Dimethyl carbonate OR Pyridinium) AND (Depression OR PTSD OR Traumatic stress OR Anxiety OR Mood disorder OR Psychological stress OR Mental disorder OR Mood disorders OR Chronic stress OR Mental health OR Suicide OR Post-traumatic stress disorder OR Depression and Anxiety OR Major depression OR Psychological trauma OR Atypical depression OR Clinical depression OR Bipolar OR Psychiatry OR Bipolar disorder OR Acute stress disorder OR Long Depression OR Traumatic memories OR Anxiety disorder OR Major depressive disorder OR Post Traumatic OR Post traumatic OR Panic disorder OR Psychological Medicine OR Melancholic depression OR Complex post-traumatic stress disorder OR Emotional and behavioral disorders OR Personality disorder OR Bipolar I disorder OR Post-traumatic embitterment disorder OR Great Depression OR Self-harm OR Psychogenic pain OR Generalized anxiety disorder OR Combat Stress OR Social anxiety OR Dissociative disorder OR Psychosis OR Bipolar violation OR Major trauma OR Psychogenic amnesia OR Delusional disorder OR Psychological resilience OR Biological Psychiatry OR Post-traumatic stress disorder and substance use disorders) AND (African American OR African Americans OR Negro OR Negroid OR Afro-Arab OR Blacks OR Black people OR African-American history OR Afro-Asians OR Afro-Latin American OR Hispanic OR Hispanic American OR Hispanics OR Latinos OR Hispanic America OR Hispanic and Latino OR Hispanic and Latino Americans OR Hispanic culture OR Mexican American OR Black Hispanic and Latino Americans OR South Asian OR Asian people OR East Asian people OR East Asian Americans OR Southeast Asian Americans OR Asian Americans OR South Asian Americans OR East Asians OR British Asian OR Asian Pacific American OR Indigenous peoples OR Indigenous peoples of the Americas OR Indigenous peoples of Africa OR Indigenous peoples of North America OR List of indigenous peoples OR List of Indigenous peoples OR Indigenous peoples in Canada OR Indigenous peoples of Eurasia OR Native Americans in the United States OR Indigenous studies OR Arab OR Arab people OR Arab Muslims OR Arab Americans OR Afro-Arab OR Arab identity OR Arabs OR Arab Malaysians OR Arabah OR Arab Canadians OR White ethnic OR White Americans OR Caucasian race OR White British OR European Americans OR White Latin American OR Nationality OR Ethnicity OR White Latin Americans OR White people OR Poverty OR Concentrated poverty OR Extreme poverty OR Relative poverty OR Asset poverty OR Poverty reduction OR Absolute poverty OR Poverty threshold OR Poverty alleviation OR Global poverty OR Poverty line OR The End of Poverty OR Poverty in the United States OR Working poor OR Secondary poverty OR Chronic poverty OR Child poverty OR Income disparity OR Rural poverty OR Lower middle class OR Measuring poverty OR Disadvantaged OR Poverty in North America OR Poverty in the Americas OR Fuel poverty OR Poor OR Relational poverty OR Poverty in the United Kingdom OR Poverty in Switzerland OR Poverty in Europe OR Poverty in the Comoros OR Causes of poverty OR Human Poverty Index OR Prosperity OR Cycle of poverty OR Poverty in Australia OR Theories of poverty OR Poverty in Northern America OR Poverty in Asia OR Basic income OR Poverty in Sweden OR Poverty in South Africa OR Poverty in the European Economic Area OR Poverty in Africa OR Poverty in South Ossetia OR Poverty in Central America OR Poverty in Bonaire OR Poverty in Jersey OR Poverty in South Korea OR Poverty in Latin America)&as_ylo=2000",Neuropsychopharmacology,True,SciDB,"Moore, Lisa D and Le, Thuc and Fan, Guoping"
