Name,Scholar Link,DOI,Bibtex,PDF Name,Year,Scholar page,Journal,Downloaded,Downloaded from,Authors
5-Methylcytosine DNA demethylation: more than losing a methyl group,https://www.annualreviews.org/content/journals/10.1146/annurev-genet-110711-155451,10.1146/annurev-genet-110711-155451,True,5-Methylcytosine DNA demethylation_ more than losing a methyl group.pdf,2012,"https://scholar.google.com/scholar?hl=en&as_vis=1&as_sdt=1,5&start=%d&q=(Methyl OR Epigenetic OR Methylation OR Magic methyl OR Methylmercury OR 5-Methylcytosine OR 5-methylcytosine OR Methyllithium OR DNA methylation OR Methyl group OR Epigenetics OR 5-methyltetrahydrofolate OR N6-Methyladenosine OR FKBP5 OR Methylamine OR Demethylase OR Protein methylation OR H3K27me3 OR Epigenomics OR Methyl lithium OR Methyl ether OR 5-O-Methylmyricetin OR 5-O-Methylgenistein OR Mercury methylation OR 5-O-Methylquercetin OR Demethylation OR Carbonyl OR O-methylation OR Purdie methylation OR Ketone OR Histone methyltransferase OR Histone OR Butyrylation OR Methyl triflate OR RRNA OR Dimethylzinc OR Methylmagnesium bromide OR Acetone OR DNA methyltransferase OR BrCN OR Dimethylformamide OR Bromide OR Child abuse OR Amine OR N-methylpyridinium chloride OR Hydrochloride OR Pyridine OR Acylation OR Dimethyl carbonate OR Pyridinium) AND (Depression OR PTSD OR Traumatic stress OR Anxiety OR Mood disorder OR Psychological stress OR Mental disorder OR Mood disorders OR Chronic stress OR Mental health OR Suicide OR Post-traumatic stress disorder OR Depression and Anxiety OR Major depression OR Psychological trauma OR Atypical depression OR Clinical depression OR Bipolar OR Psychiatry OR Bipolar disorder OR Acute stress disorder OR Long Depression OR Traumatic memories OR Anxiety disorder OR Major depressive disorder OR Post Traumatic OR Post traumatic OR Panic disorder OR Psychological Medicine OR Melancholic depression OR Complex post-traumatic stress disorder OR Emotional and behavioral disorders OR Personality disorder OR Bipolar I disorder OR Post-traumatic embitterment disorder OR Great Depression OR Self-harm OR Psychogenic pain OR Generalized anxiety disorder OR Combat Stress OR Social anxiety OR Dissociative disorder OR Psychosis OR Bipolar violation OR Major trauma OR Psychogenic amnesia OR Delusional disorder OR Psychological resilience OR Biological Psychiatry OR Post-traumatic stress disorder and substance use disorders) AND (African American OR African Americans OR Negro OR Negroid OR Afro-Arab OR Blacks OR Black people OR African-American history OR Afro-Asians OR Afro-Latin American OR Hispanic OR Hispanic American OR Hispanics OR Latinos OR Hispanic America OR Hispanic and Latino OR Hispanic and Latino Americans OR Hispanic culture OR Mexican American OR Black Hispanic and Latino Americans OR South Asian OR Asian people OR East Asian people OR East Asian Americans OR Southeast Asian Americans OR Asian Americans OR South Asian Americans OR East Asians OR British Asian OR Asian Pacific American OR Indigenous peoples OR Indigenous peoples of the Americas OR Indigenous peoples of Africa OR Indigenous peoples of North America OR List of indigenous peoples OR List of Indigenous peoples OR Indigenous peoples in Canada OR Indigenous peoples of Eurasia OR Native Americans in the United States OR Indigenous studies OR Arab OR Arab people OR Arab Muslims OR Arab Americans OR Afro-Arab OR Arab identity OR Arabs OR Arab Malaysians OR Arabah OR Arab Canadians OR White ethnic OR White Americans OR Caucasian race OR White British OR European Americans OR White Latin American OR Nationality OR Ethnicity OR White Latin Americans OR White people OR Poverty OR Concentrated poverty OR Extreme poverty OR Relative poverty OR Asset poverty OR Poverty reduction OR Absolute poverty OR Poverty threshold OR Poverty alleviation OR Global poverty OR Poverty line OR The End of Poverty OR Poverty in the United States OR Working poor OR Secondary poverty OR Chronic poverty OR Child poverty OR Income disparity OR Rural poverty OR Lower middle class OR Measuring poverty OR Disadvantaged OR Poverty in North America OR Poverty in the Americas OR Fuel poverty OR Poor OR Relational poverty OR Poverty in the United Kingdom OR Poverty in Switzerland OR Poverty in Europe OR Poverty in the Comoros OR Causes of poverty OR Human Poverty Index OR Prosperity OR Cycle of poverty OR Poverty in Australia OR Theories of poverty OR Poverty in Northern America OR Poverty in Asia OR Basic income OR Poverty in Sweden OR Poverty in South Africa OR Poverty in the European Economic Area OR Poverty in Africa OR Poverty in South Ossetia OR Poverty in Central America OR Poverty in Bonaire OR Poverty in Jersey OR Poverty in South Korea OR Poverty in Latin America)&as_ylo=2000",Annual Review of Genetics,True,SciDB,"Franchini, Don-Marc and Schmitz, Kerstin-Maike and Petersen-Mahrt, Svend K."
"Nutrition and epigenetics: an interplay of dietary methyl donors, one-carbon metabolism and DNA methylation",https://www.sciencedirect.com/science/article/pii/S0955286312000599,10.1016/j.jnutbio.2012.03.003,True,Nutrition and epigenetics_ an interplay of dietary methyl donors_ one-carbon metabolism and DNA methylation.pdf,2012,"https://scholar.google.com/scholar?hl=en&as_vis=1&as_sdt=1,5&start=%d&q=(Methyl OR Epigenetic OR Methylation OR Magic methyl OR Methylmercury OR 5-Methylcytosine OR 5-methylcytosine OR Methyllithium OR DNA methylation OR Methyl group OR Epigenetics OR 5-methyltetrahydrofolate OR N6-Methyladenosine OR FKBP5 OR Methylamine OR Demethylase OR Protein methylation OR H3K27me3 OR Epigenomics OR Methyl lithium OR Methyl ether OR 5-O-Methylmyricetin OR 5-O-Methylgenistein OR Mercury methylation OR 5-O-Methylquercetin OR Demethylation OR Carbonyl OR O-methylation OR Purdie methylation OR Ketone OR Histone methyltransferase OR Histone OR Butyrylation OR Methyl triflate OR RRNA OR Dimethylzinc OR Methylmagnesium bromide OR Acetone OR DNA methyltransferase OR BrCN OR Dimethylformamide OR Bromide OR Child abuse OR Amine OR N-methylpyridinium chloride OR Hydrochloride OR Pyridine OR Acylation OR Dimethyl carbonate OR Pyridinium) AND (Depression OR PTSD OR Traumatic stress OR Anxiety OR Mood disorder OR Psychological stress OR Mental disorder OR Mood disorders OR Chronic stress OR Mental health OR Suicide OR Post-traumatic stress disorder OR Depression and Anxiety OR Major depression OR Psychological trauma OR Atypical depression OR Clinical depression OR Bipolar OR Psychiatry OR Bipolar disorder OR Acute stress disorder OR Long Depression OR Traumatic memories OR Anxiety disorder OR Major depressive disorder OR Post Traumatic OR Post traumatic OR Panic disorder OR Psychological Medicine OR Melancholic depression OR Complex post-traumatic stress disorder OR Emotional and behavioral disorders OR Personality disorder OR Bipolar I disorder OR Post-traumatic embitterment disorder OR Great Depression OR Self-harm OR Psychogenic pain OR Generalized anxiety disorder OR Combat Stress OR Social anxiety OR Dissociative disorder OR Psychosis OR Bipolar violation OR Major trauma OR Psychogenic amnesia OR Delusional disorder OR Psychological resilience OR Biological Psychiatry OR Post-traumatic stress disorder and substance use disorders) AND (African American OR African Americans OR Negro OR Negroid OR Afro-Arab OR Blacks OR Black people OR African-American history OR Afro-Asians OR Afro-Latin American OR Hispanic OR Hispanic American OR Hispanics OR Latinos OR Hispanic America OR Hispanic and Latino OR Hispanic and Latino Americans OR Hispanic culture OR Mexican American OR Black Hispanic and Latino Americans OR South Asian OR Asian people OR East Asian people OR East Asian Americans OR Southeast Asian Americans OR Asian Americans OR South Asian Americans OR East Asians OR British Asian OR Asian Pacific American OR Indigenous peoples OR Indigenous peoples of the Americas OR Indigenous peoples of Africa OR Indigenous peoples of North America OR List of indigenous peoples OR List of Indigenous peoples OR Indigenous peoples in Canada OR Indigenous peoples of Eurasia OR Native Americans in the United States OR Indigenous studies OR Arab OR Arab people OR Arab Muslims OR Arab Americans OR Afro-Arab OR Arab identity OR Arabs OR Arab Malaysians OR Arabah OR Arab Canadians OR White ethnic OR White Americans OR Caucasian race OR White British OR European Americans OR White Latin American OR Nationality OR Ethnicity OR White Latin Americans OR White people OR Poverty OR Concentrated poverty OR Extreme poverty OR Relative poverty OR Asset poverty OR Poverty reduction OR Absolute poverty OR Poverty threshold OR Poverty alleviation OR Global poverty OR Poverty line OR The End of Poverty OR Poverty in the United States OR Working poor OR Secondary poverty OR Chronic poverty OR Child poverty OR Income disparity OR Rural poverty OR Lower middle class OR Measuring poverty OR Disadvantaged OR Poverty in North America OR Poverty in the Americas OR Fuel poverty OR Poor OR Relational poverty OR Poverty in the United Kingdom OR Poverty in Switzerland OR Poverty in Europe OR Poverty in the Comoros OR Causes of poverty OR Human Poverty Index OR Prosperity OR Cycle of poverty OR Poverty in Australia OR Theories of poverty OR Poverty in Northern America OR Poverty in Asia OR Basic income OR Poverty in Sweden OR Poverty in South Africa OR Poverty in the European Economic Area OR Poverty in Africa OR Poverty in South Ossetia OR Poverty in Central America OR Poverty in Bonaire OR Poverty in Jersey OR Poverty in South Korea OR Poverty in Latin America)&as_ylo=2000",The Journal of Nutritional Biochemistry,True,SciDB,"Anderson, Olivia S. and Sant, Karilyn E. and Dolinoy, Dana C."
Maternal methyl supplements in mice affect epigenetic variation and DNA methylation of offspring,https://www.sciencedirect.com/science/article/pii/S0022316622153915,10.1093/jn/132.8.2393s,True,,2002,"https://scholar.google.com/scholar?hl=en&as_vis=1&as_sdt=1,5&start=%d&q=(Methyl OR Epigenetic OR Methylation OR Magic methyl OR Methylmercury OR 5-Methylcytosine OR 5-methylcytosine OR Methyllithium OR DNA methylation OR Methyl group OR Epigenetics OR 5-methyltetrahydrofolate OR N6-Methyladenosine OR FKBP5 OR Methylamine OR Demethylase OR Protein methylation OR H3K27me3 OR Epigenomics OR Methyl lithium OR Methyl ether OR 5-O-Methylmyricetin OR 5-O-Methylgenistein OR Mercury methylation OR 5-O-Methylquercetin OR Demethylation OR Carbonyl OR O-methylation OR Purdie methylation OR Ketone OR Histone methyltransferase OR Histone OR Butyrylation OR Methyl triflate OR RRNA OR Dimethylzinc OR Methylmagnesium bromide OR Acetone OR DNA methyltransferase OR BrCN OR Dimethylformamide OR Bromide OR Child abuse OR Amine OR N-methylpyridinium chloride OR Hydrochloride OR Pyridine OR Acylation OR Dimethyl carbonate OR Pyridinium) AND (Depression OR PTSD OR Traumatic stress OR Anxiety OR Mood disorder OR Psychological stress OR Mental disorder OR Mood disorders OR Chronic stress OR Mental health OR Suicide OR Post-traumatic stress disorder OR Depression and Anxiety OR Major depression OR Psychological trauma OR Atypical depression OR Clinical depression OR Bipolar OR Psychiatry OR Bipolar disorder OR Acute stress disorder OR Long Depression OR Traumatic memories OR Anxiety disorder OR Major depressive disorder OR Post Traumatic OR Post traumatic OR Panic disorder OR Psychological Medicine OR Melancholic depression OR Complex post-traumatic stress disorder OR Emotional and behavioral disorders OR Personality disorder OR Bipolar I disorder OR Post-traumatic embitterment disorder OR Great Depression OR Self-harm OR Psychogenic pain OR Generalized anxiety disorder OR Combat Stress OR Social anxiety OR Dissociative disorder OR Psychosis OR Bipolar violation OR Major trauma OR Psychogenic amnesia OR Delusional disorder OR Psychological resilience OR Biological Psychiatry OR Post-traumatic stress disorder and substance use disorders) AND (African American OR African Americans OR Negro OR Negroid OR Afro-Arab OR Blacks OR Black people OR African-American history OR Afro-Asians OR Afro-Latin American OR Hispanic OR Hispanic American OR Hispanics OR Latinos OR Hispanic America OR Hispanic and Latino OR Hispanic and Latino Americans OR Hispanic culture OR Mexican American OR Black Hispanic and Latino Americans OR South Asian OR Asian people OR East Asian people OR East Asian Americans OR Southeast Asian Americans OR Asian Americans OR South Asian Americans OR East Asians OR British Asian OR Asian Pacific American OR Indigenous peoples OR Indigenous peoples of the Americas OR Indigenous peoples of Africa OR Indigenous peoples of North America OR List of indigenous peoples OR List of Indigenous peoples OR Indigenous peoples in Canada OR Indigenous peoples of Eurasia OR Native Americans in the United States OR Indigenous studies OR Arab OR Arab people OR Arab Muslims OR Arab Americans OR Afro-Arab OR Arab identity OR Arabs OR Arab Malaysians OR Arabah OR Arab Canadians OR White ethnic OR White Americans OR Caucasian race OR White British OR European Americans OR White Latin American OR Nationality OR Ethnicity OR White Latin Americans OR White people OR Poverty OR Concentrated poverty OR Extreme poverty OR Relative poverty OR Asset poverty OR Poverty reduction OR Absolute poverty OR Poverty threshold OR Poverty alleviation OR Global poverty OR Poverty line OR The End of Poverty OR Poverty in the United States OR Working poor OR Secondary poverty OR Chronic poverty OR Child poverty OR Income disparity OR Rural poverty OR Lower middle class OR Measuring poverty OR Disadvantaged OR Poverty in North America OR Poverty in the Americas OR Fuel poverty OR Poor OR Relational poverty OR Poverty in the United Kingdom OR Poverty in Switzerland OR Poverty in Europe OR Poverty in the Comoros OR Causes of poverty OR Human Poverty Index OR Prosperity OR Cycle of poverty OR Poverty in Australia OR Theories of poverty OR Poverty in Northern America OR Poverty in Asia OR Basic income OR Poverty in Sweden OR Poverty in South Africa OR Poverty in the European Economic Area OR Poverty in Africa OR Poverty in South Ossetia OR Poverty in Central America OR Poverty in Bonaire OR Poverty in Jersey OR Poverty in South Korea OR Poverty in Latin America)&as_ylo=2000",The Journal of Nutrition,False,,"Cooney, Craig A. and Dave, Apurva A. and Wolff, George L."
Profound Methyl Effects in Drug Discovery and a Call for New C H Methylation Reactions,https://onlinelibrary.wiley.com/doi/abs/10.1002/anie.201303207,10.1002/chin.201405245,True,Profound Methyl Effects in Drug Discovery and a Call for New C_ H Methylation Reactions.pdf,2014,"https://scholar.google.com/scholar?hl=en&as_vis=1&as_sdt=1,5&start=%d&q=(Methyl OR Epigenetic OR Methylation OR Magic methyl OR Methylmercury OR 5-Methylcytosine OR 5-methylcytosine OR Methyllithium OR DNA methylation OR Methyl group OR Epigenetics OR 5-methyltetrahydrofolate OR N6-Methyladenosine OR FKBP5 OR Methylamine OR Demethylase OR Protein methylation OR H3K27me3 OR Epigenomics OR Methyl lithium OR Methyl ether OR 5-O-Methylmyricetin OR 5-O-Methylgenistein OR Mercury methylation OR 5-O-Methylquercetin OR Demethylation OR Carbonyl OR O-methylation OR Purdie methylation OR Ketone OR Histone methyltransferase OR Histone OR Butyrylation OR Methyl triflate OR RRNA OR Dimethylzinc OR Methylmagnesium bromide OR Acetone OR DNA methyltransferase OR BrCN OR Dimethylformamide OR Bromide OR Child abuse OR Amine OR N-methylpyridinium chloride OR Hydrochloride OR Pyridine OR Acylation OR Dimethyl carbonate OR Pyridinium) AND (Depression OR PTSD OR Traumatic stress OR Anxiety OR Mood disorder OR Psychological stress OR Mental disorder OR Mood disorders OR Chronic stress OR Mental health OR Suicide OR Post-traumatic stress disorder OR Depression and Anxiety OR Major depression OR Psychological trauma OR Atypical depression OR Clinical depression OR Bipolar OR Psychiatry OR Bipolar disorder OR Acute stress disorder OR Long Depression OR Traumatic memories OR Anxiety disorder OR Major depressive disorder OR Post Traumatic OR Post traumatic OR Panic disorder OR Psychological Medicine OR Melancholic depression OR Complex post-traumatic stress disorder OR Emotional and behavioral disorders OR Personality disorder OR Bipolar I disorder OR Post-traumatic embitterment disorder OR Great Depression OR Self-harm OR Psychogenic pain OR Generalized anxiety disorder OR Combat Stress OR Social anxiety OR Dissociative disorder OR Psychosis OR Bipolar violation OR Major trauma OR Psychogenic amnesia OR Delusional disorder OR Psychological resilience OR Biological Psychiatry OR Post-traumatic stress disorder and substance use disorders) AND (African American OR African Americans OR Negro OR Negroid OR Afro-Arab OR Blacks OR Black people OR African-American history OR Afro-Asians OR Afro-Latin American OR Hispanic OR Hispanic American OR Hispanics OR Latinos OR Hispanic America OR Hispanic and Latino OR Hispanic and Latino Americans OR Hispanic culture OR Mexican American OR Black Hispanic and Latino Americans OR South Asian OR Asian people OR East Asian people OR East Asian Americans OR Southeast Asian Americans OR Asian Americans OR South Asian Americans OR East Asians OR British Asian OR Asian Pacific American OR Indigenous peoples OR Indigenous peoples of the Americas OR Indigenous peoples of Africa OR Indigenous peoples of North America OR List of indigenous peoples OR List of Indigenous peoples OR Indigenous peoples in Canada OR Indigenous peoples of Eurasia OR Native Americans in the United States OR Indigenous studies OR Arab OR Arab people OR Arab Muslims OR Arab Americans OR Afro-Arab OR Arab identity OR Arabs OR Arab Malaysians OR Arabah OR Arab Canadians OR White ethnic OR White Americans OR Caucasian race OR White British OR European Americans OR White Latin American OR Nationality OR Ethnicity OR White Latin Americans OR White people OR Poverty OR Concentrated poverty OR Extreme poverty OR Relative poverty OR Asset poverty OR Poverty reduction OR Absolute poverty OR Poverty threshold OR Poverty alleviation OR Global poverty OR Poverty line OR The End of Poverty OR Poverty in the United States OR Working poor OR Secondary poverty OR Chronic poverty OR Child poverty OR Income disparity OR Rural poverty OR Lower middle class OR Measuring poverty OR Disadvantaged OR Poverty in North America OR Poverty in the Americas OR Fuel poverty OR Poor OR Relational poverty OR Poverty in the United Kingdom OR Poverty in Switzerland OR Poverty in Europe OR Poverty in the Comoros OR Causes of poverty OR Human Poverty Index OR Prosperity OR Cycle of poverty OR Poverty in Australia OR Theories of poverty OR Poverty in Northern America OR Poverty in Asia OR Basic income OR Poverty in Sweden OR Poverty in South Africa OR Poverty in the European Economic Area OR Poverty in Africa OR Poverty in South Ossetia OR Poverty in Central America OR Poverty in Bonaire OR Poverty in Jersey OR Poverty in South Korea OR Poverty in Latin America)&as_ylo=2000",ChemInform,True,SciDB,"Schoenherr, Heike and Cernak, Tim"
Demethylation of (Cytosine-5-C-methyl) DNA and regulation of transcription in the epigenetic pathways of cancer development,https://link.springer.com/article/10.1007/s10555-008-9118-y,10.1007/s10555-008-9118-y,True,Demethylation of _Cytosine-5-C-methyl_ DNA and regulation of transcription in the epigenetic pathways of cancer development.pdf,2008,"https://scholar.google.com/scholar?hl=en&as_vis=1&as_sdt=1,5&start=%d&q=(Methyl OR Epigenetic OR Methylation OR Magic methyl OR Methylmercury OR 5-Methylcytosine OR 5-methylcytosine OR Methyllithium OR DNA methylation OR Methyl group OR Epigenetics OR 5-methyltetrahydrofolate OR N6-Methyladenosine OR FKBP5 OR Methylamine OR Demethylase OR Protein methylation OR H3K27me3 OR Epigenomics OR Methyl lithium OR Methyl ether OR 5-O-Methylmyricetin OR 5-O-Methylgenistein OR Mercury methylation OR 5-O-Methylquercetin OR Demethylation OR Carbonyl OR O-methylation OR Purdie methylation OR Ketone OR Histone methyltransferase OR Histone OR Butyrylation OR Methyl triflate OR RRNA OR Dimethylzinc OR Methylmagnesium bromide OR Acetone OR DNA methyltransferase OR BrCN OR Dimethylformamide OR Bromide OR Child abuse OR Amine OR N-methylpyridinium chloride OR Hydrochloride OR Pyridine OR Acylation OR Dimethyl carbonate OR Pyridinium) AND (Depression OR PTSD OR Traumatic stress OR Anxiety OR Mood disorder OR Psychological stress OR Mental disorder OR Mood disorders OR Chronic stress OR Mental health OR Suicide OR Post-traumatic stress disorder OR Depression and Anxiety OR Major depression OR Psychological trauma OR Atypical depression OR Clinical depression OR Bipolar OR Psychiatry OR Bipolar disorder OR Acute stress disorder OR Long Depression OR Traumatic memories OR Anxiety disorder OR Major depressive disorder OR Post Traumatic OR Post traumatic OR Panic disorder OR Psychological Medicine OR Melancholic depression OR Complex post-traumatic stress disorder OR Emotional and behavioral disorders OR Personality disorder OR Bipolar I disorder OR Post-traumatic embitterment disorder OR Great Depression OR Self-harm OR Psychogenic pain OR Generalized anxiety disorder OR Combat Stress OR Social anxiety OR Dissociative disorder OR Psychosis OR Bipolar violation OR Major trauma OR Psychogenic amnesia OR Delusional disorder OR Psychological resilience OR Biological Psychiatry OR Post-traumatic stress disorder and substance use disorders) AND (African American OR African Americans OR Negro OR Negroid OR Afro-Arab OR Blacks OR Black people OR African-American history OR Afro-Asians OR Afro-Latin American OR Hispanic OR Hispanic American OR Hispanics OR Latinos OR Hispanic America OR Hispanic and Latino OR Hispanic and Latino Americans OR Hispanic culture OR Mexican American OR Black Hispanic and Latino Americans OR South Asian OR Asian people OR East Asian people OR East Asian Americans OR Southeast Asian Americans OR Asian Americans OR South Asian Americans OR East Asians OR British Asian OR Asian Pacific American OR Indigenous peoples OR Indigenous peoples of the Americas OR Indigenous peoples of Africa OR Indigenous peoples of North America OR List of indigenous peoples OR List of Indigenous peoples OR Indigenous peoples in Canada OR Indigenous peoples of Eurasia OR Native Americans in the United States OR Indigenous studies OR Arab OR Arab people OR Arab Muslims OR Arab Americans OR Afro-Arab OR Arab identity OR Arabs OR Arab Malaysians OR Arabah OR Arab Canadians OR White ethnic OR White Americans OR Caucasian race OR White British OR European Americans OR White Latin American OR Nationality OR Ethnicity OR White Latin Americans OR White people OR Poverty OR Concentrated poverty OR Extreme poverty OR Relative poverty OR Asset poverty OR Poverty reduction OR Absolute poverty OR Poverty threshold OR Poverty alleviation OR Global poverty OR Poverty line OR The End of Poverty OR Poverty in the United States OR Working poor OR Secondary poverty OR Chronic poverty OR Child poverty OR Income disparity OR Rural poverty OR Lower middle class OR Measuring poverty OR Disadvantaged OR Poverty in North America OR Poverty in the Americas OR Fuel poverty OR Poor OR Relational poverty OR Poverty in the United Kingdom OR Poverty in Switzerland OR Poverty in Europe OR Poverty in the Comoros OR Causes of poverty OR Human Poverty Index OR Prosperity OR Cycle of poverty OR Poverty in Australia OR Theories of poverty OR Poverty in Northern America OR Poverty in Asia OR Basic income OR Poverty in Sweden OR Poverty in South Africa OR Poverty in the European Economic Area OR Poverty in Africa OR Poverty in South Ossetia OR Poverty in Central America OR Poverty in Bonaire OR Poverty in Jersey OR Poverty in South Korea OR Poverty in Latin America)&as_ylo=2000",Cancer and Metastasis Reviews,True,SciDB,"Patra, Samir Kumar and Patra, Aditi and Rizzi, Federica and Ghosh, Tapash Chandra and Bettuzzi, Saverio"
