Title,Abstract,Journal
Biological Embedding of Early-Life Adversity and a Scoping Review of the Evidence for Intergenerational Epigenetic Transmission of Stress and Trauma in Humans.,"Severe or chronic stress and trauma can have a detrimental impact on health. Evidence suggests that early-life adversity can become biologically embedded and has the potential to influence health outcomes decades later. Epigenetics is one mechanism that has been implicated in these long-lasting effects. Observational studies in humans indicate that the effects of stress could even persist across generations, although whether or not epigenetic mechanisms are involved remains under debate. Here, we provide an overview of studies in animals and humans that demonstrate the effects of early-life stress on DNA methylation, one of the most widely studied epigenetic mechanisms, and summarize findings from animal models demonstrating the involvement of epigenetics in the transmission of stress across generations. We then describe the results of a scoping review to determine the extent to which the terms intergenerational or transgenerational have been used in human studies investigating the transmission of trauma and stress via epigenetic mechanisms. We end with a discussion of key areas for future research to advance understanding of the role of epigenetics in the legacy effects of stress and trauma.",Genes
MicroRNAs in Post-traumatic Stress Disorder.,"Post-traumatic stress disorder (PTSD) is a psychiatric disorder that can develop following exposure to or witnessing of a (potentially) threatening event. A critical issue is to pinpoint the (neuro)biological mechanisms underlying the susceptibility to stress-related disorder such as PTSD, which develops in the minority of ~15% of individuals exposed to trauma. Over the last few years, a first wave of epigenetic studies has been performed in an attempt to identify the molecular underpinnings of the long-lasting behavioral and mental effects of trauma exposure. The potential roles of non-coding RNAs (ncRNAs) such as microRNAs (miRNAs) in moderating or mediating the impact of severe stress and trauma are increasingly gaining attention. To date, most studies focusing on the roles of miRNAs in PTSD have, however, been completed in animals, using cross-sectional study designs and focusing almost exclusively on subjects with susceptible phenotypes. Therefore, there is a strong need for new research comprising translational and cross-species approaches that use longitudinal designs for studying trajectories of change contrasting susceptible and resilient subjects. The present review offers a comprehensive overview of available studies of miRNAs in PTSD and discusses the current challenges, pitfalls, and future perspectives of this field.",Current topics in behavioral neurosciences
Epigenetic regulation in radiation-induced pulmonary fibrosis.,"Radiation-induced pulmonary fibrosis (RIPF) is a common and serious adverse effect of radiotherapy for thoracic tumors, which occurs in the irreversible stage of radiation-induced lung injury (RILI) >6 months after irradiation. It is characterized by progressive and irreversible destruction of lung tissue and deterioration of lung function, which may impair quality of life and lead to respiratory failure and death. We hope this will draw attention to the involvement of epigenetics in the regulation of RIPF.",International journal of radiation biology
"Epigenetics of Posttraumatic Stress Disorder: Current Evidence, Challenges, and Future Directions.","Posttraumatic stress disorder (PTSD) is a stress-related psychiatric disorder that is thought to emerge from complex interactions among traumatic events and multiple genetic factors. Epigenetic regulation lies at the heart of these interactions and mediates the lasting effects of the environment on gene regulation. An increasing body of evidence in human subjects with PTSD supports a role for epigenetic regulation of distinct genes and pathways in the pathogenesis of PTSD. The role of epigenetic regulation is further supported by studies examining fear conditioning in rodent models. Although this line of research offers an exciting outlook for future epigenetic research in PTSD, important limitations include the tissue specificity of epigenetic modifications, the phenomenologic definition of the disorder, and the challenge of translating molecular evidence across species. These limitations call for studies that combine data from postmortem human brain tissue and animal models, assess longitudinal epigenetic changes in living subjects, and examine dimensional phenotypes in addition to diagnoses. Moreover, examining the environmental, genetic, and epigenetic factors that promote resilience to trauma may lead to important advances in the field.",Biological psychiatry
Epigenetic mechanisms activated by childhood adversity.,"Adverse childhood experiences (ACE) impair health and life expectancy and may result in an epigenetic signature that drives increased morbidity primed during early stages of life. This literature review focuses on the current evidence for epigenetic-mediated programming of brain and immune function resulting from ACE. To address this aim, a total of 88 articles indexed in PubMed before August 2019 concerning ACE and epigenetics were surveyed. Current evidence partially supports epigenetic programming of the hypothalamic-pituitary-adrenal axis, but convincingly shows that ACE impairs immune function. Additionally, the needs and challenges that face this area are discussed in order to provide a framework that may help to clarify the role of epigenetics in the long-lasting effects of ACE.",Epigenomics
The role of mitochondria in myocardial damage caused by energy metabolism disorders: From mechanisms to therapeutics.,"Myocardial damage is the most serious pathological consequence of cardiovascular diseases and an important reason for their high mortality. In recent years, because of the high prevalence of systemic energy metabolism disorders (e.g., obesity, diabetes mellitus, and metabolic syndrome), complications of myocardial damage caused by these disorders have attracted widespread attention. Energy metabolism disorders are independent of traditional injury-related risk factors, such as ischemia, hypoxia, trauma, and infection. An imbalance of myocardial metabolic flexibility and myocardial energy depletion are usually the initial changes of myocardial injury caused by energy metabolism disorders, and abnormal morphology and functional destruction of the mitochondria are their important features. Specifically, mitochondria are the centers of energy metabolism, and recent evidence has shown that decreased mitochondrial function, caused by an imbalance in mitochondrial quality control, may play a key role in myocardial injury caused by energy metabolism disorders. Under chronic energy stress, mitochondria undergo pathological fission, while mitophagy, mitochondrial fusion, and biogenesis are inhibited, and mitochondrial protein balance and transfer are disturbed, resulting in the accumulation of nonfunctional and damaged mitochondria. Consequently, damaged mitochondria lead to myocardial energy depletion and the accumulation of large amounts of reactive oxygen species, further aggravating the imbalance in mitochondrial quality control and forming a vicious cycle. In addition, impaired mitochondria coordinate calcium homeostasis imbalance, and epigenetic alterations participate in the pathogenesis of myocardial damage. These pathological changes induce rapid progression of myocardial damage, eventually leading to heart failure or sudden cardiac death. To intervene more specifically in the myocardial damage caused by metabolic disorders, we need to understand the specific role of mitochondria in this context in detail. Accordingly, promising therapeutic strategies have been proposed. We also summarize the existing therapeutic strategies to provide a reference for clinical treatment and developing new therapies.",Free radical biology & medicine
Epigenetic Mechanisms of Traumatic Brain Injuries.,"Of all types of injuries, traumatic brain injuries (TBIs) are most likely to result in death or permanent physical or mental disabilities. With the increased frequency of military operations, terror attacks, sports activities, and road mishaps, TBIs are increasingly becoming a serious public health concern. Patients who meet with moderate-to-severe TBI suffer from a constellation of cognitive deficits and phenotypes due to diffuse axonal injury. On the contrary, minimal TBI precipitates in long-term behavioral complications commonly referred to as post-traumatic stress disorders, which consist of depression, anxiety, hallucinations, and so on. During the last decade, epigenetic mechanisms, such as histone posttranslational modifications, DNA methylation, and noncoding RNAs, have received reasonable attention by scientists studying the neurobiology of TBI. Chromatin remodeling sculpted by various epigenetic factors in different parts of the brain controls many intricate processes involved in important neural functions. Although stable and dogmatic, the reversible nature of epigenetic modifications has attracted special attention for their emerging potential in therapeutic development. Herein, we offer an overview of recent observations on epigenetic pathways that are likely involved in shaping neural function and maintain the state of neuropathology in response to traumatic events.",Progress in molecular biology and translational science
Advancing burn wound treatment: exploring hydrogel as a transdermal drug delivery system.,"Burn injuries are prevalent and life-threatening forms that contribute significantly to mortality rates due to associated wound infections. The management of burn wounds presents substantial challenges. Hydrogel exhibits tremendous potential as an ideal alternative to traditional wound dressings such as gauze. This is primarily attributed to its three-dimensional (3D) crosslinked polymer network, which possesses a high water content, fostering a moist environment that supports effective burn wound healing. Additionally, hydrogel facilitates the penetration of loaded therapeutic agents throughout the wound surface, combating burn wound pathogens through the hydration effect and thereby enhancing the healing process. However, the presence of eschar formation on burn wounds obstructs the passive diffusion of therapeutics, impairing the efficacy of hydrogel as a wound dressing, particularly in cases of severe burns involving deeper tissue damage. This review focuses on exploring the potential of hydrogel as a carrier for transdermal drug delivery in burn wound treatment. Furthermore, strategies aimed at enhancing the transdermal delivery of therapeutic agents from hydrogel to optimize burn wound healing are also discussed.",Drug delivery
Epigenetics of neural repair following spinal cord injury.,"Spinal cord injury results from an insult inflicted on the spinal cord that usually encompasses its 4 major functions (motor, sensory, autonomic, and reflex). The type of deficits resulting from spinal cord injury arise from primary insult, but their long-term severity is due to a multitude of pathophysiological processes during the secondary phase of injury. The failure of the mammalian spinal cord to regenerate and repair is often attributed to the very feature that makes the central nervous system special-it becomes so highly specialized to perform higher functions that it cannot effectively reactivate developmental programs to re-build novel circuitry to restore function after injury. Added to this is an extensive gliotic and immune response that is essential for clearance of cellular debris, but also lays down many obstacles that are detrimental to regeneration. Here, we discuss how the mature chromatin state of different central nervous system cells (neural, glial, and immune) may contribute to secondary pathophysiology, and how restoring silenced developmental gene expression by altering histone acetylation could stall secondary damage and contribute to novel approaches to stimulate endogenous repair.",Neurotherapeutics : the journal of the American Society for Experimental NeuroTherapeutics
Kdm6a-CNN1 axis orchestrates epigenetic control of trauma-induced spinal cord microvascular endothelial cell senescence to balance neuroinflammation for improved neurological repair.,"Cellular senescence assumes pivotal roles in various diseases through the secretion of proinflammatory factors. Despite extensive investigations into vascular senescence associated with aging and degenerative diseases, the molecular mechanisms governing microvascular endothelial cell senescence induced by traumatic stress, particularly its involvement in senescence-induced inflammation, remain insufficiently elucidated. In this study, we present a comprehensive demonstration and characterization of microvascular endothelial cell senescence induced by spinal cord injury (SCI). Lysine demethylase 6A (Kdm6a), commonly known as UTX, emerges as a crucial regulator of cell senescence in injured spinal cord microvascular endothelial cells (SCMECs). Upregulation of UTX induces senescence in SCMECs, leading to an amplified release of proinflammatory factors, specifically the senescence-associated secretory phenotype (SASP) components, thereby modulating the inflammatory microenvironment. Conversely, the deletion of UTX in endothelial cells shields SCMECs against senescence, mitigates the release of proinflammatory SASP factors, and promotes neurological functional recovery after SCI. UTX forms an epigenetic regulatory axis by binding to calponin 1 (CNN1), orchestrating trauma-induced SCMECs senescence and SASP secretion, thereby influencing neuroinflammation and neurological functional repair. Furthermore, local delivery of a senolytic drug reduces senescent SCMECs and suppresses proinflammatory SASP secretion, reinstating a local regenerative microenvironment and enhancing functional repair after SCI. In conclusion, targeting the UTX-CNN1 epigenetic axis to prevent trauma-induced SCMECs senescence holds the potential to inhibit SASP secretion, alleviate neuroinflammation, and provide a novel treatment strategy for SCI repair.",Bone research
S100A8 regulates autophagy-dependent ferroptosis in microglia after experimental subarachnoid hemorrhage.,"Targeting microglial activation has been shown to ameliorate early brain injury (EBI) after subarachnoid hemorrhage (SAH). Ferroptosis is a new form of programmed cell death after SAH, but these molecular features were not recognized as evidence of microglial function so far. In this study, we constructed microglial S100A8-specific knockdown and established the SAH model in vivo and in vitro. Multi-technology strategies, including high throughput sequencing, adeno-associated virus gene gene-editing and several molecular biotechnologies to validate the effects of S100A8 on microglial autophagy and ferroptosis after SAH. Our results revealed that the expression of S100A8 was significantly increased in brain tissue after SAH. Targeted microglial S100A8 inhibition improved neural function and neuronal apoptosis in mice after SAH. Further mechanism exploration found that favourable effects of S100A8 depletion in EBI may be through the inhibition of microglia autophagy-dependent ferroptosis. In conclusion, S100A8 may be a potential intervention target for microglial ferroptosis in EBI after SAH.",Experimental neurology
UTX deletion promotes M2 macrophage polarization by epigenetically regulating endothelial cell-macrophage crosstalk after spinal cord injury.,"Macrophages polarized to the M2 subtype after spinal cord injury (SCI) are beneficial for promoting neurological recovery. The crosstalk between endothelial cells (ECs) and macrophages is crucial for the imbalance between proinflammatory and pro-resolving responses caused by macrophage heterogeneity; however, this crosstalk is strengthened post-SCI, leading to inflammatory cascades and second damage. As a powerful means to regulate gene expression, epigenetic regulation of the interaction between immune cells and ECs in SCI is still largely unknown. Our previous research demonstrated that the histone demethylase UTX deletion in ECs (UTX<sup>-/-</sup> ECs) promotes neurological recovery, while the precise mechanism is unrevealed. Here, we discovered that UTX<sup>-/-</sup> ECs polarize macrophages toward the M2 subtype post-SCI. Macrophage deficiency could block the neurological recovery caused by the knockdown of UTX. The exosomes from UTX<sup>-/-</sup> ECs mediate this crosstalk. In addition, we found UTX, H3K27, and miR-467b-3p/Sfmbt2 promoters forming a regulatory complex that upregulates the miR-467b-3p in UTX<sup>-/-</sup> ECs. And then, miR-467b-3p transfers to macrophages by exosomes and activates the PI3K/AKT/mTOR signaling by decreasing PTEN expression, finally polarizing macrophage to the M2 subtype. This study reveals a mechanism by epigenetic regulation of ECs-macrophages crosstalk and identifies potential targets, which may provide opportunities for treating SCI.",Journal of nanobiotechnology
Exploring epigenetic strategies for the treatment of osteoporosis.,"The worldwide trend toward an aging population has resulted in a higher incidence of chronic conditions, such as osteoporosis. Osteoporosis, a prevalent skeletal disorder characterized by decreased bone mass and increased fracture risk, encompasses primary and secondary forms, each with distinct etiologies. Mechanistically, osteoporosis involves an imbalance between bone resorption by osteoclasts and bone formation by osteoblasts. Current pharmacological interventions for osteoporosis, such as bisphosphonates, denosumab, and teriparatide, aim to modulate bone turnover and preserve bone density. Hormone replacement therapy and lifestyle modifications are also recommended to manage the condition. While current medications offer therapeutic options, they are not devoid of limitations. Recent studies have highlighted the importance of epigenetic mechanisms, including DNA methylation and histone modifications, in regulating gene expression during bone remodeling. The use of epigenetic drugs, or epidrugs, to target these mechanisms offers a promising avenue for therapeutic intervention in osteoporosis. In this review, we comprehensively examine the recent advancements in the application of epidrugs for treating osteoporosis.",Molecular biology reports
DNA methylation-mediated Rbpjk suppression protects against fracture nonunion caused by systemic inflammation.,"Challenging skeletal repairs are frequently seen in patients experiencing systemic inflammation. To tackle the complexity and heterogeneity of the skeletal repair process, we performed single-cell RNA sequencing and revealed that progenitor cells were one of the major lineages responsive to elevated inflammation and this response adversely affected progenitor differentiation by upregulation of Rbpjk in fracture nonunion. We then validated the interplay between inflammation (via constitutive activation of Ikk2, Ikk2ca) and Rbpjk specifically in progenitors by using genetic animal models. Focusing on epigenetic regulation, we identified Rbpjk as a direct target of Dnmt3b. Mechanistically, inflammation decreased Dnmt3b expression in progenitor cells, consequently leading to Rbpjk upregulation via hypomethylation within its promoter region. We also showed that Dnmt3b loss-of-function mice phenotypically recapitulated the fracture repair defects observed in Ikk2ca-transgenic mice, whereas Dnmt3b-transgenic mice alleviated fracture repair defects induced by Ikk2ca. Moreover, Rbpjk ablation restored fracture repair in both Ikk2ca mice and Dnmt3b loss-of-function mice. Altogether, this work elucidates a common mechanism involving a NF-κB/Dnmt3b/Rbpjk axis within the context of inflamed bone regeneration. Building on this mechanistic insight, we applied local treatment with epigenetically modified progenitor cells in a previously established mouse model of inflammation-mediated fracture nonunion and showed a functional restoration of bone regeneration under inflammatory conditions through an increase in progenitor differentiation potential.",The Journal of clinical investigation
Bi-directional neuro-immune dysfunction after chronic experimental brain injury.,"It is well established that traumatic brain injury (TBI) causes acute and chronic alterations in systemic immune function and that systemic immune changes contribute to posttraumatic neuroinflammation and neurodegeneration. However, how TBI affects bone marrow (BM) hematopoietic stem/progenitor cells chronically and to what extent such changes may negatively impact innate immunity and neurological function has not been examined.",Journal of neuroinflammation
Stress and trauma: BDNF control of dendritic-spine formation and regression.,"Chronic restraint stress leads to increases in brain derived neurotrophic factor (BDNF) mRNA and protein in some regions of the brain, e.g. the basal lateral amygdala (BLA) but decreases in other regions such as the CA3 region of the hippocampus and dendritic spine density increases or decreases in line with these changes in BDNF. Given the powerful influence that BDNF has on dendritic spine growth, these observations suggest that the fundamental reason for the direction and extent of changes in dendritic spine density in a particular region of the brain under stress is due to the changes in BDNF there. The most likely cause of these changes is provided by the stress initiated release of steroids, which readily enter neurons and alter gene expression, for example that of BDNF. Of particular interest is how glucocorticoids and mineralocorticoids tend to have opposite effects on BDNF gene expression offering the possibility that differences in the distribution of their receptors and of their downstream effects might provide a basis for the differential transcription of the BDNF genes. Alternatively, differences in the extent of methylation and acetylation in the epigenetic control of BDNF transcription are possible in different parts of the brain following stress. Although present evidence points to changes in BDNF transcription being the major causal agent for the changes in spine density in different parts of the brain following stress, steroids have significant effects on downstream pathways from the TrkB receptor once it is acted upon by BDNF, including those that modulate the density of dendritic spines. Finally, although glucocorticoids play a canonical role in determining BDNF modulation of dendritic spines, recent studies have shown a role for corticotrophin releasing factor (CRF) in this regard. There is considerable improvement in the extent of changes in spine size and density in rodents with forebrain specific knockout of CRF receptor 1 (CRFR1) even when the glucocorticoid pathways are left intact. It seems then that CRF does have a role to play in determining BDNF control of dendritic spines.",Progress in neurobiology
Osteoarthritis year in review 2020: imaging.,"This narrative ""Year in Review"" highlights a selection of articles published between January 2019 and April 2020, to be presented at the OARSI World Congress 2020 within the field of osteoarthritis (OA) imaging. Articles were obtained from a PubMed search covering the above period, utilizing a variety of relevant search terms. We then selected original and review studies on OA-related imaging in humans, particularly those with direct clinical relevance, with a focus on the knee. Topics selected encompassed clinically relevant models of early OA, particularly imaging applications on cruciate ligament rupture, as these are of direct clinical interest and provide potential opportunity to evaluate preventive therapy. Further, imaging applications on structural modification of articular tissues in patients with established OA, by non-pharmacological, pharmacological and surgical interventions are summarized. Finally, novel deep learning approaches to imaging are reviewed, as these facilitate implementation and scaling of quantitative imaging application in clinical trials and clinical practice. Methodological or observational studies outside these key focus areas were not included. Studies focused on biology, biomechanics, biomarkers, genetics and epigenetics, and clinical studies that did not contain an imaging component are covered in other articles within the OARSI ""Year in Review"" series. In conclusion, exciting progress has been made in clinically validating human models of early OA, and the field of automated articular tissue segmentation. Most importantly though, it has been shown that structure modification of articular cartilage is possible, and future research should focus on the translation of these structural findings to clinical benefit.",Osteoarthritis and cartilage
