Title,Abstract,Journal
"Transcriptomic, Epigenomic, and Neuroanatomic Signatures Differ in Chronic Prurigo, Atopic Dermatitis, and Brachioradial Pruritus.","Scratching and scratch-induced injuries, including neuroanatomical alterations, are key characteristics of chronic pruritus entities of different origins. The aim of this study was to link gene expression (array hybridization, qPCR) with DNA methylation (array hybridization) and neuroanatomy (PGP9.5 staining) in chronic nodular prurigo (CNPG), atopic dermatitis (AD), brachioradial pruritus (BRP), and matched healthy controls. Specific signatures of gene expression and DNA methylation clearly discriminated pruritic lesional skin from nonpruritic skin in CNPG and from healthy skin of volunteers, respectively. Although intraepidermal nerve fiber density was indiscriminately reduced, the level of epidermal branching, assessed by a semiquantitative pattern analysis, differentiated the entities (CNPG > BRP > AD). Correspondingly, repellent SEMA3A showed the highest expression in AD, whereas axonal growth-promoting nerve GF was most prominent in CNPG and BRP. Overexpression of genes for nerve fiber regeneration (NELL2/NFKB/ARTN) was found in AD and CNPG but not in BRP. Our findings suggest that differential branching patterns rather than mere innervation density separate chronic itch conditions and reflect disease-specific local expression profiles. In pruritic dermatoses (AD and CNPG), nerve injury and subsequent sprouting may primarily result from chronic scratching, whereas genuine neuropathy is expected to underlie BRP.",The Journal of investigative dermatology
Exosomes as a new pain biomarker opportunity.,"Exosomes are extracellular microvesicles implicated in intercellular communication with ability to transfer cargo molecules, including protein, lipids, and nucleic acids, at both close and distant target sites. It has been shown that exosomes are implicated in physiological and pathological processes. In recent years, the interest on exosomes' role in many pain states has increased. Their involvements in pain processes have been demonstrated by studies on different chronic pain diseases, both inflammatory and neuropathic, such as osteoarthritis, rheumatoid arthritis, inflammatory bowel diseases, neurodegenerative pathologies, complex regional pain syndrome, and peripheral nerve injury. Animal and clinical studies investigated exosomes-based treatments, showing their ability to improve painful symptoms with fewer side effects, with potential immunoprotective and anti-inflammatory effect. Specific molecular patterns characterize exosomes' cargo according to the cellular origin, epigenetic modifications, environmental state, and stressor factors. Therefore, the identification of specific cargo's profile associated to pain states may lead to recognize specific pathological states and to consider the use of exosomes as biomarkers of diseases. Furthermore, exosomes' ability to transfer information and their presence in many accessible biological fluids suggest a potential use as novel non-invasive therapeutic tools in pain field.",Molecular pain
Transgenerational Inheritance and Systemic Racism in America.,"It is well established that personal experiences of trauma, adversity, and discrimination can ""get under the skin"" and increase risk for a whole host of negative mental and physical health outcomes. The aim of this article is to review emerging research on transgenerational epigenetic inheritance which suggests that negative exposures in one generation, can also be passed down to affect the health and well-being of future generations.",Psychiatric research and clinical practice
"A Synthetic Steroid 5α-Androst-3β, 5, 6β-triol Alleviates Radiation-Induced Brain Injury in Mice via Inhibiting GBP5/NF-κB/NLRP3 Signal Axis.","Radiotherapy for head and neck tumors can lead to a severe complication known as radiation-induced brain injury (RIBI). However, the underlying mechanism of RIBI development remains unclear, and limited prevention and treatment options are available. Neuroactive steroids have shown potential in treating neurological disorders. 5α-Androst-3β, 5, 6β-triol (TRIOL), a synthetic neuroprotective steroid, holds promise as a treatment candidate for RIBI patients. However, the neuroprotective effects and underlying mechanism of TRIOL on RIBI treatment are yet to be elucidated. In the present study, our findings demonstrate TRIOL's potential as a neuroprotective agent against RIBI. In gamma knife irradiation mouse model, TRIOL treatment significantly reduced brain necrosis volume, microglial activation, and neuronal loss. RNA-sequencing, immunofluorescence, real-time quantitative polymerase chain reaction, siRNA transfection, and western blotting techniques revealed that TRIOL effectively decreased microglial activation, proinflammatory cytokine release, neuron loss, and guanylate-binding protein 5 (GBP5) expression, along with its downstream signaling pathways NF-κB and NLRP3 activation in vitro. In summary, TRIOL effectively alleviate RIBI by inhibiting the GBP5/NF-κB/NLRP3 signal axis, reducing microglia activation and pro-inflammation cytokines release, rescuing neuron loss. This study highlights the potential of TRIOL as a novel and promising therapy drug for RIBI treatment.",Molecular neurobiology
Targets for protection and mitigation of radiation injury.,"Protection of normal tissues against toxic effects of ionizing radiation is a critical issue in clinical and environmental radiobiology. Investigations in recent decades have suggested potential targets that are involved in the protection against radiation-induced damages to normal tissues and can be proposed for mitigation of radiation injury. Emerging evidences have been shown to be in contrast to an old dogma in radiation biology; a major amount of reactive oxygen species (ROS) production and cell toxicity occur during some hours to years after exposure to ionizing radiation. This can be attributed to upregulation of inflammatory and fibrosis mediators, epigenetic changes and disruption of the normal metabolism of oxygen. In the current review, we explain the cellular and molecular changes following exposure of normal tissues to ionizing radiation. Furthermore, we review potential targets that can be proposed for protection and mitigation of radiation toxicity.",Cellular and molecular life sciences : CMLS
Epigenetic responses to heat: From adaptation to maladaptation.,"What is the topic of this review? This review outlines the history of research on epigenetic adaptations to heat exposure. The perspective taken is that adaptations reflect properties of hormesis, whereby low, repeated doses of heat induce adaptation (acclimation/acclimatization); whereas brief, life-threatening exposures can induce maladaptive responses. What advances does it highlight? The epigenetic mechanisms underlying acclimation/acclimatization comprise specific molecular programmes on histones that regulate heat shock proteins transcriptionally and protect the organism from subsequent heat exposures, even after long delays. The epigenetic signalling underlying maladaptive responses might rely, in part, on extensive changes in DNA methylation that are sustained over time and might contribute to later health challenges.",Experimental physiology
Traumatic stress and human DNA methylation: a critical review.,"Animal studies have identified persistent and functional effects of traumatic stress on the epigenome. This review discusses the clinical evidence for trauma-induced changes in DNA methylation across the life span in humans. Studies are reviewed based on reports of trauma exposure during the prenatal period (13 studies), early life (20 studies), and adulthood (ten studies). Even though it is apparent that traumatic stress influences the human epigenome, there are significant drawbacks in the existing human literature. These include a lack of longitudinal studies, methodological heterogeneity, selection of tissue type, and the influence of developmental stage and trauma type on methylation outcomes. These issues are discussed in order to present a way in which future studies can gain more insight into the functional relevance of trauma-related DNA methylation changes. Epigenetic studies investigating the detrimental effects of traumatic stress have great potential for an improved detection and treatment of trauma-related psychiatric disorders.",Epigenomics
[Psychological trauma as risk for delayed psychiatric disorders: epigenetic mechanisms].,"Psychological trauma is considered to be a risk factor for the development of a number of psychiatric disorders. Although 40-90% of the population is exposed to a traumatic event in their lifetime, only a small fraction of individuals will develop a disorder. In recent years, numerous studies described epigenetic changes, such as DNA methylation, histone modifications and non-coding RNA as potential biological mechanisms by which the environment can have long-term effects on an organism.",Der Nervenarzt
Current updates in precision and personalized medicine in sepsis and trauma.,"Precision and personalized medicine remain an elusive but illustrious goal in the realm of critical care, particularly in the areas of trauma and sepsis. These aims specifically refer to data gathering, interpretation, and treatment application on an individualized basis in the clinical care of patients. Until now, personalized medicine has mainly remained focused on genetics and epigenetic phenomena and has propelled clinical care forward, especially in the field of oncology. Advances in technology and methodology continue to proliferate in early-phase research, and some of these advancements are well poised to break into the clinical sphere of critical care. Here, we describe 2 topics at the forefront of investigation with potent and imminent potential for clinical application.",Surgery
Epigenetic Regulation of Axon Regeneration after Neural Injury.,"When peripheral axons are damaged, neuronal injury signaling pathways induce transcriptional changes that support axon regeneration and consequent functional recovery. The recent development of bioinformatics techniques has allowed for the identification of many of the regeneration-associated genes that are regulated by neural injury, yet it remains unclear how global changes in transcriptome are coordinated. In this article, we review recent studies on the epigenetic mechanisms orchestrating changes in gene expression in response to nerve injury. We highlight the importance of epigenetic mechanisms in discriminating efficient axon regeneration in the peripheral nervous system and very limited axon regrowth in the central nervous system and discuss the therapeutic potential of targeting epigenetic regulators to improve neural recovery.",Molecules and cells
"You Are What Your Mother Endured: Intergenerational Epigenetics, Early Caregiving, and the Temporal Embedding of Adversity.","Environmental epigenetics has become a site of growing attention related to the intergenerational effects of stress, trauma, and adversity. This article draws on a multi-sited ethnography of epigenetic knowledge production in the United States and Canada to document how scientists conceptualize, model, and measure these experiences and their effects on children's neurodevelopmental and behavioral health. We find that scientists' efforts to identify the molecular effects of stress, trauma, and adversity results in a temporal focus on the mother-child dyad during early life. This has the effect of biologizing early childhood adversity, positioning it as a consequence of caregiving, and producing epigenetic findings that often align with individually oriented interventions rather than social and structural change. Our analysis suggests that epigenetic models of stress, trauma, and adversity therefore situate histories of oppression, inequality, and subjugation in discrete and gendered family relations, resulting in the temporal embedding of adversity during early life.",Medical anthropology quarterly
[DNA methylation in experimental ischemic brain injury].,"The enrichment of angioneurology with fundamental advances leads to the understanding of new important facets in the pathogenesis of cerebral ischemia. The knowledge of epigenetic mechanisms in the development of stroke, in particular, DNA methylation, which makes a significant contribution to the development and formation of cerebral damage, is becoming more and more relevant. This review reflects an analysis of animal studies proving the relationship of DNA methylation with cerebral ischemia. As a result of the search work, 282 articles from the PubMed database were selected for keywords that corresponded to this topic. Of these publications, 8 studies were devoted to genome-wide DNA methylation, and 6 published the results of DNA methylation of candidate genes in experimental cerebral ischemia. The results have demonstrated that brain DNA methylation in animals is associated with the development of ischemic stroke and may play a role in several pathogenetic mechanisms. In two studies, a decrease in the level of DNA methylation in 2 genes in ischemic brain tissues of laboratory animals was found, at the same time, in four studies, 8 genes, in which methylation increased after ischemic stroke, were reported. These data suggest that the assessment of the level of DNA methylation in stroke is a promising biomarker for the search and improvement of pharmacological and non-pharmacological methods for limiting brain damage in ischemic and reperfusion injury at the stages of preclinical and clinical studies.",Zhurnal nevrologii i psikhiatrii imeni S.S. Korsakova
Disordered APP metabolism and neurovasculature in trauma and aging: Combined risks for chronic neurodegenerative disorders.,"Traumatic brain injury (TBI), advanced age, and cerebral vascular disease are factors conferring increased risk for late onset Alzheimer's disease (AD). These conditions are also related pathologically through multiple interacting mechanisms. The hallmark pathology of AD consists of pathological aggregates of amyloid-β (Aβ) peptides and tau proteins. These molecules are also involved in neuropathology of several other chronic neurodegenerative diseases, and are under intense investigation in the aftermath of TBI as potential contributors to the risk for developing AD and chronic traumatic encephalopathy (CTE). The pathology of TBI is complex and dependent on injury severity, age-at-injury, and length of time between injury and neuropathological evaluation. In addition, the mechanisms influencing pathology and recovery after TBI likely involve genetic/epigenetic factors as well as additional disorders or comorbid states related to age and central and peripheral vascular health. In this regard, dysfunction of the aging neurovascular system could be an important link between TBI and chronic neurodegenerative diseases, either as a precipitating event or related to accumulation of AD-like pathology which is amplified in the context of aging. Thus with advanced age and vascular dysfunction, TBI can trigger self-propagating cycles of neuronal injury, pathological protein aggregation, and synaptic loss resulting in chronic neurodegenerative disease. In this review we discuss evidence supporting TBI and aging as dual, interacting risk factors for AD, and the role of Aβ and cerebral vascular dysfunction in this relationship. Evidence is discussed that Aβ is involved in cyto- and synapto-toxicity after severe TBI, and that its chronic effects are potentiated by aging and impaired cerebral vascular function. From a therapeutic perspective, we emphasize that in the fields of TBI- and aging-related neurodegeneration protective strategies should include preservation of neurovascular function.",Ageing research reviews
Photocarcinogenesis: an overview.,"Photocarcinogenesis represents the sum of a complex of simultaneous and sequential biochemical events that ultimately lead to the occurrence of skin cancer. These events, initiated by UV radiation of appropriate wavelength, include the formation of DNA photoproducts: DNA repair; mutation of proto-oncogenes and tumor suppressor genes; UV-production of radical species with subsequent effects on mutation and extra-nuclear function; and other epigenetic events that influence the course of carcinogenesis. The epigenetic influences may include immunological responses, antioxidant defenses, and dietary factors. This review represents an effort to provide current research results in the aforementioned areas and an attempt to meld these events into a comprehensive overview of photocarcinogenesis. If effective prevention and intervention strategies for skin cancer are to developed, a more thorough understanding of the disease process is imperative.","Journal of photochemistry and photobiology. B, Biology"
Amifostine-Loaded Nanocarrier Traverses the Blood-Brain Barrier and Prevents Radiation-Induced Brain Injury.,"Radiation-induced brain injury (RIBI) is a severe, irreversible, or even life-threatening cerebral complication of radiotherapy in patients with head and neck tumors, and there is no satisfying prevention and effective treatment available for these patients. Amifostine (AMF) is a well-known free radical scavenger with demonstrated effectiveness in preventing radiation-induced toxicity. However, the limited permeability of AMF across the blood-brain barrier (BBB) when administered intravenously reduces the effectiveness of AMF in preventing RIBI. Herein, we construct a nanoparticle (NP) platform for BBB delivery of AMF. AMF is conjugated with 1,2-dioleoyl-<i>sn</i>-glycero-3-phosphoethanolamine-<i>n</i>-[poly(ethylene glycol)]-hydroxy succinamide [DSPE-PEG-NHS, PEG M 2000], and the product is DSPE-PEG-AMF. Then, the nanoparticles (DAPP NPs) were formed by self-assembly of poly(lactic-<i>co</i>-glycolic acid) (PLGA), DSPE-PEG-AMF, and polysorbate 80 (PS 80). PEG shields the nanoparticles from blood clearance by the reticuloendothelial system and lengthens the drug circulation time. PS 80 is used to encapsulate nanoparticles for medication delivery to the brain. The results of our study showed that DAPP NPs were able to effectively penetrate the blood-brain barrier (BBB) in healthy C57BL/6 mice. Furthermore, in a well-established mouse model of X-knife-induced brain injury, treatment with DAPP NPs (corresponding to 250 mg/kg AMF) was found to significantly reduce the volume of brain necrosis compared to mice treated with AMF (250 mg/kg). Importantly, the use of DAPP NPs was also shown to significantly mitigate the effects of radiation-induced neuronal damage and glial activation. This work presents a convenient brain-targeted AMF delivery system to achieve effective radioprotection for the brain, providing a promising strategy with tremendous clinical translation potential.",ACS applied materials & interfaces
Epigenetic mechanisms of neurodegenerative diseases and acute brain injury.,"Epigenetic modifications are emerging as major players in the pathogenesis of neurodegenerative disorders and susceptibility to acute brain injury. DNA and histone modifications act together with non-coding RNAs to form a complex gene expression machinery that adapts the brain to environmental stressors and injury response. These modifications influence cell-level operations like neurogenesis and DNA repair to large, intricate processes such as brain patterning, memory formation, motor function and cognition. Thus, epigenetic imbalance has been shown to influence the progression of many neurological disorders independent of aberrations in the genetic code. This review aims to highlight ways in which epigenetics applies to several commonly researched neurodegenerative diseases and forms of acute brain injury as well as shed light on the benefits of epigenetics-based treatments.",Neurochemistry international
Adenosine kinase: An epigenetic modulator in development and disease.,"Adenosine kinase (ADK) is the key regulator of adenosine and catalyzes the metabolism of adenosine to 5'-adenosine monophosphate. The enzyme exists in two isoforms: a long isoform (ADK-long, ADK-L) and a short isoform (ADK-short, ADK-S). The two isoforms are developmentally regulated and are differentially expressed in distinct subcellular compartments with ADK-L localized in the nucleus and ADK-S localized in the cytoplasm. The nuclear localization of ADK-L and its biochemical link to the transmethylation pathway suggest a specific role for gene regulation via epigenetic mechanisms. Recent evidence reveals an adenosine receptor-independent role of ADK in determining the global methylation status of DNA and thereby contributing to epigenomic regulation. Here we summarize recent progress in understanding the biochemical interactions between adenosine metabolism by ADK-L and epigenetic modifications linked to transmethylation reactions. This review will provide a comprehensive overview of ADK-associated changes in DNA methylation in developmental, as well as in pathological conditions including brain injury, epilepsy, vascular diseases, cancer, and diabetes. Challenges in investigating the epigenetic role of ADK for therapeutic gains are briefly discussed.",Neurochemistry international
Chronic neurodegenerative consequences of traumatic brain injury.,"Traumatic brain injury (TBI) is a serious public health concern and a major cause of death and disability worldwide. Each year, an estimated 1.7 million Americans sustain TBI of which ~52,000 people die, ~275,000 people are hospitalized and 1,365,000 people are treated as emergency outpatients. Currently there are ~5.3 million Americans living with TBI. TBI is more of a disease process than of an event that is associated with immediate and long-term sensomotor, psychological and cognitive impairments. TBI is the best known established epigenetic risk factor for later development of neurodegenerative diseases and dementia. People sustaining TBI are ~4 times more likely to develop dementia at a later stage than people without TBI. Single brain injury is linked to later development of symptoms resembling Alzheimer's disease while repetitive brain injuries are linked to later development of chronic traumatic encephalopathy (CTE) and/or Dementia Pugilistica (DP). Furthermore, genetic background of ß-amyloid precursor protein (APP), Apolipoprotein E (ApoE), presenilin (PS) and neprilysin (NEP) genes is associated with exacerbation of neurodegenerative process after TBI. This review encompasses acute effects and chronic neurodegenerative consequences after TBI.",Restorative neurology and neuroscience
Toxic Environments and the Embedded Psyche.,"A discussion of the recent transition to a new geological epoch, the Anthropocene, opens this article. The need to declare a new era has been declared necessary by geologists, together with other scientists and critical commentators due to the inordinate amount of human-made destruction being imposed on the globe and its inhabitants. This destruction disproportionally effects those who are economically deprived and experience discrimination. An account of the recognition and routinization of epigenetics follows, in which an unexamined assumption of genetic determinism is debunked. A move to recognize human existence everywhere as contextualized in environments that impinge on body functioning throughout life opens up a discussion of the embodiment of trauma followed by six illustrative examples from the newly recognized field of environmental epigenetics.",Medical anthropology quarterly
Long noncoding RNA (lncRNA): a target in neuropathic pain.,"Current treatments for neuropathic pain are limited in part due to the incomplete understanding of its underlying mechanisms. Recent evidence reveals the dysregulated expression of long non-coding RNAs (lncRNAs) in the damaged nerve, dorsal root ganglion (DRG), and spinal cord dorsal horn following peripheral nerve injury. However, the role of the majority of lncRNAs in neuropathic pain genesis is still elusive. Unveiling the mechanisms of how lncRNAs participate in neuropathic pain may develop new strategies to prevent and/or treat this disorder. Areas covered: This review focuses on the dysregulation of lncRNAs in the DRG, dorsal horn, and the injured nerves from preclinical models of neuropathic pain. We provide evidence of how peripheral nerve injury causes the dysregulation of lncRNAs in these pain-related regions. The potential mechanisms of how dysregulated lncRNAs contribute to the pathogenesis of neuropathic pain are discussed. Expert opinion: The investigation on the role of the dysregulated lncRNAs in neuropathic pain might open up a novel avenue for therapeutic treatment of this disorder. However, current investigation is at the infancy stage, which challenges the translation of preclinical findings. More intensive studies on lncRNAs are required before the preclinical findings are translated into therapeutic management for neuropathic pain.",Expert opinion on therapeutic targets
