Title,Abstract,Journal
Valproic Acid and Epilepsy: From Molecular Mechanisms to Clinical Evidences.,"After more than a century from its discovery, valproic acid (VPA) still represents one of the most efficient antiepileptic drugs (AEDs). Pre and post-synaptic effects of VPA depend on a very broad spectrum of actions, including the regulation of ionic currents and the facilitation of GABAergic over glutamatergic transmission. As a result, VPA indirectly modulates neurotransmitter release and strengthens the threshold for seizure activity. However, even though participating to the anticonvulsant action, such mechanisms seem to have minor impact on epileptogenesis. Nonetheless, VPA has been reported to exert anti-epileptogenic effects. Epigenetic mechanisms, including histone deacetylases (HDACs), BDNF and GDNF modulation are pivotal to orientate neurons toward a neuroprotective status and promote dendritic spines organization. From such broad spectrum of actions comes constantly enlarging indications for VPA. It represents a drug of choice in child and adult with epilepsy, with either general or focal seizures, and is a consistent and safe IV option in generalized convulsive status epilepticus. Moreover, since VPA modulates DNA transcription through HDACs, recent evidences point to its use as an anti-nociceptive in migraine prophylaxis, and, even more interestingly, as a positive modulator of chemotherapy in cancer treatment. Furthermore, VPA-induced neuroprotection is under investigation for benefit in stroke and traumatic brain injury. Hence, VPA has still got its place in epilepsy, and yet deserves attention for its use far beyond neurological diseases. In this review, we aim to highlight, with a translational intent, the molecular basis and the clinical indications of VPA.",Current neuropharmacology
Epigenetics in radiation-induced fibrosis.,"Radiotherapy is a major cancer treatment option but dose-limiting side effects such as late-onset fibrosis in the irradiated tissue severely impair quality of life in cancer survivors. Efforts to explain radiation-induced fibrosis, for example, by genetic variation remained largely inconclusive. Recently published molecular analyses on radiation response and fibrogenesis showed a prominent role of epigenetic gene regulation. This review summarizes the current knowledge on epigenetic modifications in fibrotic disease and radiation response, and it points out the important role for epigenetic mechanisms such as DNA methylation, microRNAs and histone modifications in the development of this disease. The synopsis illustrates the complexity of radiation-induced fibrosis and reveals the need for investigations to further unravel its molecular mechanisms. Importantly, epigenetic changes are long-term determinants of gene expression and can therefore support those mechanisms that induce and perpetuate fibrogenesis even in the absence of the initial damaging stimulus. Future work must comprise the interconnection of acute radiation response and long-lasting epigenetic effects in order to assess their role in late-onset radiation fibrosis. An improved understanding of the underlying biology is fundamental to better comprehend the origin of this disease and to improve both preventive and therapeutic strategies.",Oncogene
Major trauma and acceleration of the ageing process.,"It is well established that numerous factors can affect the rate at which we age biologically. Diet, physical activity, lifestyle and our genes all play a major role in influencing the ageing trajectory and longevity. Major trauma affects millions globally, is the major cause of death in young adults and could influence ageing processes but has largely been ignored by biogenterologists. The long-term health consequences of physical trauma are well known in the medical community, how trauma effects the ageing process at a molecular level is not. It has long been difficult to assess ageing trajectories due to the absence of a biomarker of biological rather than chronological age. Recent advances in epigenetics have helped by identifying specific DNA methylation sites as good indicators of biological age. Recent investigations into the impact of psychological trauma and the associated physical stress on accelerating ageing as measured by epigenetic drift are promising. The physical and metabolic stress which is synonymous with physical trauma may also accelerate the ageing process. We suggest that long term epigenetic profiling is required to understand to what degree the ageing trajectory is altered by trauma, which will in turn add support for the development of novel therapies to improve health outcomes for survivors of traumatic injury.",Ageing research reviews
A nerve injury-specific long noncoding RNA promotes neuropathic pain by increasing Ccl2 expression.,"Maladaptive changes of nerve injury-associated genes in dorsal root ganglia (DRGs) are critical for neuropathic pain genesis. Emerging evidence supports the role of long noncoding RNAs (lncRNAs) in regulating gene transcription. Here we identified a conserved lncRNA, named nerve injury-specific lncRNA (NIS-lncRNA) for its upregulation in injured DRGs exclusively in response to nerve injury. This upregulation was triggered by nerve injury-induced increase in DRG ELF1, a transcription factor that bound to the NIS-lncRNA promoter. Blocking this upregulation attenuated nerve injury-induced CCL2 increase in injured DRGs and nociceptive hypersensitivity during the development and maintenance periods of neuropathic pain. Mimicking NIS-lncRNA upregulation elevated CCL2 expression, increased CCL2-mediated excitability in DRG neurons, and produced neuropathic pain symptoms. Mechanistically, NIS-lncRNA recruited more binding of the RNA-interacting protein FUS to the Ccl2 promoter and augmented Ccl2 transcription in injured DRGs. Thus, NIS-lncRNA participates in neuropathic pain likely by promoting FUS-triggered DRG Ccl2 expression and may be a potential target in neuropathic pain management.",The Journal of clinical investigation
Molecular Mechanisms of Neuroprotection by Ketone Bodies and Ketogenic Diet in Cerebral Ischemia and Neurodegenerative Diseases.,"Ketone bodies (KBs), such as acetoacetate and β-hydroxybutyrate, serve as crucial alternative energy sources during glucose deficiency. KBs, generated through ketogenesis in the liver, are metabolized into acetyl-CoA in extrahepatic tissues, entering the tricarboxylic acid cycle and electron transport chain for ATP production. Reduced glucose metabolism and mitochondrial dysfunction correlate with increased neuronal death and brain damage during cerebral ischemia and neurodegeneration. Both KBs and the ketogenic diet (KD) demonstrate neuroprotective effects by orchestrating various cellular processes through metabolic and signaling functions. They enhance mitochondrial function, mitigate oxidative stress and apoptosis, and regulate epigenetic and post-translational modifications of histones and non-histone proteins. Additionally, KBs and KD contribute to reducing neuroinflammation and modulating autophagy, neurotransmission systems, and gut microbiome. This review aims to explore the current understanding of the molecular mechanisms underpinning the neuroprotective effects of KBs and KD against brain damage in cerebral ischemia and neurodegenerative diseases, including Alzheimer's disease and Parkinson's disease.",International journal of molecular sciences
Borderline personality - from psychoanalysis to epigenetics. Biological basis of attachment.,"In terms of object relations theory, borderline personality disorder (BPD) is characterized by a structural abnormality of identity, conflicting representations of self and others, and disorganization of attachment - a construct rooted in an individual's early experiences and central to the relationships established later in life. A special role in the formation of attachment style is attributed to the relationship with the caregiver and to difficult experiences or traumas from early developmental stages. These experiences not only provide the psychological basis for the development of an insecure attachment style, but also leave a biological mark in the body in the form of epigenetic modifications. Although research on epigenetic modifications in BPD is scarce, a growing body of evidence supports the importance of oxytocin - the ""social peptide"" underlying attachment - in the etiology of BPD. We believe that the study of epigenetic modifications that affect the action of oxytocin in the BPD clinical population will provide a better understanding of the basis and process of development of the disorder, as well as provide a therapeutic direction to work effectively in the major areas of BPD.",Psychiatria polska
Recent Genetics and Epigenetics Approaches to PTSD.,"Following a life-threatening traumatic exposure, about 10% of those exposed are at considerable risk for developing posttraumatic stress disorder (PTSD), a severe and disabling syndrome characterized by uncontrollable intrusive memories, nightmares, avoidance behaviors, and hyperarousal in addition to impaired cognition and negative emotion symptoms. This review will explore recent genetic and epigenetic approaches to PTSD that explain some of the differential risk following trauma exposure.",Current psychiatry reports
Single-cell and spatial atlases of spinal cord injury in the Tabulae Paralytica.,"Here, we introduce the Tabulae Paralytica-a compilation of four atlases of spinal cord injury (SCI) comprising a single-nucleus transcriptome atlas of half a million cells, a multiome atlas pairing transcriptomic and epigenomic measurements within the same nuclei, and two spatial transcriptomic atlases of the injured spinal cord spanning four spatial and temporal dimensions. We integrated these atlases into a common framework to dissect the molecular logic that governs the responses to injury within the spinal cord<sup>1</sup>. The Tabulae Paralytica uncovered new biological principles that dictate the consequences of SCI, including conserved and divergent neuronal responses to injury; the priming of specific neuronal subpopulations to upregulate circuit-reorganizing programs after injury; an inverse relationship between neuronal stress responses and the activation of circuit reorganization programs; the necessity of re-establishing a tripartite neuroprotective barrier between immune-privileged and extra-neural environments after SCI and a failure to form this barrier in old mice. We leveraged the Tabulae Paralytica to develop a rejuvenative gene therapy that re-established this tripartite barrier, and restored the natural recovery of walking after paralysis in old mice. The Tabulae Paralytica provides a window into the pathobiology of SCI, while establishing a framework for integrating multimodal, genome-scale measurements in four dimensions to study biology and medicine.",Nature
Spinal cord repair is modulated by the neurogenic factor Hb-egf under direction of a regeneration-associated enhancer.,"Unlike adult mammals, zebrafish regenerate spinal cord tissue and recover locomotor ability after a paralyzing injury. Here, we find that ependymal cells in zebrafish spinal cords produce the neurogenic factor Hb-egfa upon transection injury. Animals with hb-egfa mutations display defective swim capacity, axon crossing, and tissue bridging after spinal cord transection, associated with disrupted indicators of neuron production. Local recombinant human HB-EGF delivery alters ependymal cell cycling and tissue bridging, enhancing functional regeneration. Epigenetic profiling reveals a tissue regeneration enhancer element (TREE) linked to hb-egfa that directs gene expression in spinal cord injuries. Systemically delivered recombinant AAVs containing this zebrafish TREE target gene expression to crush injuries of neonatal, but not adult, murine spinal cords. Moreover, enhancer-based HB-EGF delivery by AAV administration improves axon densities after crush injury in neonatal cords. Our results identify Hb-egf as a neurogenic factor necessary for innate spinal cord regeneration and suggest strategies to improve spinal cord repair in mammals.",Nature communications
A phase 2 study of thalidomide for the treatment of radiation-induced blood-brain barrier injury.,"Radiation-induced brain injury (RIBI) is a debilitating sequela after radiotherapy to treat head and neck cancer, and 20 to 30% of patients with RIBI fail to respond to or have contraindications to the first-line treatments of bevacizumab and corticosteroids. Here, we reported a Simon's minmax two-stage, single-arm, phase 2 clinical trial (NCT03208413) to assess the efficacy of thalidomide in patients with RIBI who were unresponsive to or had contraindications to bevacizumab and corticosteroid therapies. The trial met its primary endpoint, with 27 of 58 patients enrolled showing ≥25% reduction in the volume of cerebral edema on fluid-attenuated inversion recovery-magnetic resonance imaging (FLAIR-MRI) after treatment (overall response rate, 46.6%; 95% CI, 33.3 to 60.1%). Twenty-five (43.1%) patients demonstrated a clinical improvement based on the Late Effects Normal Tissues-Subjective, Objective, Management, Analytic (LENT/SOMA) scale, and 36 (62.1%) experienced cognitive improvement based on the Montreal Cognitive Assessment (MoCA) scores. In a mouse model of RIBI, thalidomide restored the blood-brain barrier and cerebral perfusion, which were attributed to the functional rescue of pericytes secondary to elevation of platelet-derived growth factor receptor β (PDGFRβ) expression by thalidomide. Our data thus demonstrate the therapeutic potential of thalidomide for the treatment of radiation-induced cerebral vasculature impairment.",Science translational medicine
On the road to epigenetic therapy.,"In this issue of the Biomedical Journal, we examine how far the explosion of epigenetic studies in recent years has translated to benefits for patients in the clinic, and we highlight an original study suggesting that increased vegetable intake protects against osteoporotic fractures. We also hear several opinions on the use, or perhaps misuse, of Impact Factor and what the future should hold for this publication metric.",Biomedical journal
HIF-1α/JMJD1A signaling regulates inflammation and oxidative stress following hyperglycemia and hypoxia-induced vascular cell injury.,"Endothelial cell (EC) injury accelerates the progression of diabetic macrovascular complications. Hypoxia is an important cause of EC injury. Hypoxia-inducible factor-1 alpha (HIF-1α) is an important hypoxia regulatory protein. Our previous studies showed that high-glucose and hypoxic conditions could upregulate HIF-1α expression and enhance EC inflammatory injury, independently of the nuclear factor kappa-B (NF-κB) pathway. However, it is not clear whether HIF-1α plays a role in vascular disease through epigenetic-related mechanisms.",Cellular & molecular biology letters
Histone methyltransferase Ezh2 coordinates mammalian axon regeneration via regulation of key regenerative pathways.,"Current treatments for neurodegenerative diseases and neural injuries face major challenges, primarily due to the diminished regenerative capacity of neurons in the mammalian CNS as they mature. Here, we investigated the role of Ezh2, a histone methyltransferase, in regulating mammalian axon regeneration. We found that Ezh2 declined in the mouse nervous system during maturation but was upregulated in adult dorsal root ganglion neurons following peripheral nerve injury to facilitate spontaneous axon regeneration. In addition, overexpression of Ezh2 in retinal ganglion cells in the CNS promoted optic nerve regeneration via both histone methylation-dependent and -independent mechanisms. Further investigation revealed that Ezh2 fostered axon regeneration by orchestrating the transcriptional silencing of genes governing synaptic function and those inhibiting axon regeneration, while concurrently activating various factors that support axon regeneration. Notably, we demonstrated that GABA transporter 2, encoded by Slc6a13, acted downstream of Ezh2 to control axon regeneration. Overall, our study underscores the potential of modulating chromatin accessibility as a promising strategy for promoting CNS axon regeneration.",The Journal of clinical investigation
"Precision medicine in trauma: a transformational frontier in patient care, education, and research.","Trauma is the leading cause of death before the age of 45 in the United States. Precision medicine (PM) is the most advanced scientific form of medical practice and seeks to gather data from the genome, environmental interactions, and lifestyles. Relating to trauma, PM promises to significantly advance our understanding of the factors that contribute to the physiologic response to injury.",European journal of trauma and emergency surgery : official publication of the European Trauma Society
Epigenetic Alterations Associated with War Trauma and Childhood Maltreatment.,"Survivors of war trauma or childhood maltreatment are at increased risk for trauma-spectrum disorders such as post-traumatic stress disorder (PTSD). In addition, traumatic stress has been associated with alterations in the neuroendocrine and the immune system, enhancing the risk for physical diseases. Traumatic experiences might even affect psychological as well as biological parameters in the next generation, i.e. traumatic stress might have transgenerational effects. This article outlines how epigenetic processes, which represent a pivotal biological mechanism for dynamic adaptation to environmental challenges, might contribute to the explanation of the long-lasting and transgenerational effects of trauma. In particular, epigenetic alterations in genes regulating the hypothalamus-pituitary-adrenal axis as well as the immune system have been observed in survivors of childhood and adult trauma. These changes could result in enduring alterations of the stress response as well as the physical health risk. Furthermore, the effects of parental trauma could be transmitted to the next generation by parental distress and the pre- and postnatal environment, as well as by epigenetic marks transmitted via the germline. While epigenetic research has a high potential of advancing our understanding of the consequences of trauma, the findings have to be interpreted with caution, as epigenetics only represent one piece of a complex puzzle of interacting biological and environmental factors. Copyright © 2015 John Wiley & Sons, Ltd.",Behavioral sciences & the law
Epigenetics and its implications for Psychology.,Epigenetics is changing the widely accepted linear conception of genome function by explaining how environmental and psychological factors regulate the activity of our genome without involving changes in the DNA sequence. Research has identified epigenetic mechanisms mediating between environmental and psychological factors that contribute to normal and abnormal behavioral development.,Psicothema
Epigenetic regulation of bone mass.,"Osteoporosis, characterised by low bone mass, poor bone structure, and an increased risk of fracture, is a major public health problem. There is increasing evidence that the influence of the environment on gene expression, through epigenetic processes, contributes to variation in BMD and fracture risk across the lifecourse. Such epigenetic processes include DNA methylation, histone and chromatin modifications and non-coding RNAs. Examples of associations with phenotype include DNA methylation in utero linked to maternal vitamin D status, and to methylation of target genes such as OPG and RANKL being associated with osteoporosis in later life. Epigenome-wide association studies and multi-omics technologies have further revealed susceptibility loci, and histone acetyltransferases, deacetylases and methylases are being considered as therapeutic targets. This review encompasses recent advances in our understanding of epigenetic mechanisms in the regulation of bone mass and osteoporosis development, and outlines possible diagnostic and prognostic biomarker applications.",Best practice & research. Clinical endocrinology & metabolism
Nerve trauma-caused downregulation of opioid receptors in primary afferent neurons: Molecular mechanisms and potential managements.,"Neuropathic pain is the most common clinical disorder destroying the quality of patient life and leading to a marked economic and social burden. Opioids are still last option for pharmacological treatment of this disorder, but their antinociceptive effects are limited in part due to the downregulation of opioid receptors in the primary afferent neurons after peripheral nerve trauma. How this downregulation occurs is not completely understood, but recent studies have demonstrated that peripheral nerve trauma drives the alterations in epigenetic modifications (including DNA methylation, histone methylation and mciroRNAs), expression of transcription factors, post-transcriptional modifications (e.g., RNA methylation) and protein translation initiation in the neurons of nerve trauma-related dorsal root ganglion (DRG) and that these alternations may be associated with nerve trauma-caused downregulation of DRG opioid receptors. This review presents how opioid receptors are downregulated in the DRG after peripheral nerve trauma, specifically focusing on distinct molecular mechanisms underlying transcriptional and translational processes. This review also discusses how this downregulation contributes to the induction and maintenance of neuropathic pain. A deeper understanding of these molecular mechanisms likely provides a novel avenue for prevention and/or treatment of neuropathic pain.",Experimental neurology
Male-mediated developmental toxicity.,"Male-mediated developmental toxicity has been of concern for many years. The public became aware of male-mediated developmental toxicity in the early 1990s when it was reported that men working at Sellafield might be causing leukemia in their children. Human and animal studies have contributed to our current understanding of male-mediated effects. Animal studies in the 1980s and 1990s suggested that genetic damage after radiation and chemical exposure might be transmitted to offspring. With the increasing understanding that there is histone retention and modification, protamine incorporation into the chromatin and DNA methylation in mature sperm and that spermatozoal RNA transcripts can play important roles in the epigenetic state of sperm, heritable studies began to be viewed differently. Recent reports using molecular approaches have demonstrated that DNA damage can be transmitted to babies from smoking fathers, and expanded simple tandem repeats minisatellite mutations were found in the germline of fathers who were exposed to radiation from the Chernobyl nuclear power plant disaster. In epidemiological studies, it is possible to clarify whether damage is transmitted to the sons after exposure of the fathers. Paternally transmitted damage to the offspring is now recognized as a complex issue with genetic as well as epigenetic components.",Asian journal of andrology
"Epigenetics as a key link between psychosocial stress and aging: concepts, evidence, mechanisms .","Psychosocial stress-especially when chronic, excessive, or occurring early in life-has been associated with accelerated aging and increased disease risk. With rapid aging of the world population, the need to elucidate the underlying mechanisms is pressing, now more so than ever. Among molecular mechanisms linking stress and aging, the present article reviews evidence on the role of epigenetics, biochemical processes that can be set into motion by stressors and in turn influence genomic function and complex phenotypes, including aging-related outcomes. The article further provides a conceptual mechanistic framework on how stress may drive epigenetic changes at susceptible genomic sites, thereby exerting systems-level effects on the aging epigenome while also regulating the expression of molecules implicated in aging-related processes. This emerging evidence, together with work examining related biological processes, begins to shed light on the epigenetic and, more broadly, molecular underpinnings of the long-hypothesized connection between stress and aging. .",Dialogues in clinical neuroscience
Epigenetic Alterations in Sports-Related Injuries.,"It is a well-known fact that physical activity benefits people of all age groups. However, highly intensive training, maladaptation, improper equipment, and lack of sufficient rest lead to contusions and sports-related injuries. From the perspectives of sports professionals and those performing regular-amateur sports activities, it is important to maintain proper levels of training, without encountering frequent injuries. The bodily responses to physical stress and intensive physical activity are detected on many levels. Epigenetic modifications, including DNA methylation, histone protein methylation, acetylation, and miRNA expression occur in response to environmental changes and play fundamental roles in the regulation of cellular activities. In the current review, we summarise the available knowledge on epigenetic alterations present in tissues and organs (e.g., muscles, the brain, tendons, and bones) as a consequence of sports-related injuries. Epigenetic mechanism observations have the potential to become useful tools in sports medicine, as predictors of approaching pathophysiological alterations and injury biomarkers that have already taken place.",Genes
