Title,Abstract,Journal
Childhood Trauma and Epigenetics: State of the Science and Future.,"There is a great deal of interest regarding the biological embedding of childhood trauma and social exposures through epigenetic mechanisms, including DNA methylation (DNAm), but a comprehensive understanding has been hindered by issues of limited reproducibility between studies. This review presents a summary of the literature on childhood trauma and DNAm, highlights issues in the field, and proposes some potential solutions.",Current environmental health reports
Epigenetics of childhood trauma: Long term sequelae and potential for treatment.,"Childhood trauma (CT) can have persistent effects on the brain and is one of the major risk factors for neuropsychiatric diseases in adulthood. Recent advances in the field of epigenetics suggest that epigenetic factors such as DNA methylation and histone modifications, as well as regulatory processes involving non-coding RNA are associated with the long-term sequelae of CT. This narrative review summarizes current knowledge on the epigenetic basis of CT and describes studies in animal models and human subjects examining how the epigenome and transcriptome are modified by CT in the brain. It discusses psychological and pharmacological interventions that can counteract epigenetic changes induced by CT and the need to establish longitudinal assessment after CT for developing more effective diagnostics and treatment strategies based on epigenetic targets.",Neuroscience and biobehavioral reviews
The influence of intergenerational trauma on epigenetics and obesity in Indigenous populations - a scoping review.,"<b>Background:</b> Research has recently begun to examine the potential intergenerational impacts of trauma on obesity.<b>Objective:</b> This scoping review examines the literature on the interactions between intergenerational trauma, epigenetics, and obesity in Indigenous populations. The review was conducted to identify what is known from the literature about how intergenerational trauma may epigenetically influence obesity in Indigenous populations.<b>Methods:</b> Following the PRISMA-ScR guidelines for scoping reviews, online databases were used to identify studies that included discussion of the four focus topics: trauma, epigenetics, obesity, and Indigeneity. The review resulted in six studies that examined those themes. The focus and findings of the selected studies varied from cultural to biological mechanisms and from discussion regarding trauma, epigenetics, obesity, or Indigeneity, but they support three broad statements. First, they support that obesity has genetic and epigenetic factors. Second, intergenerational trauma is prevalent in Indigenous communities. Finally, intergenerational trauma has cultural and biological influences on obesity.<b>Conclusions:</b> Current literature illustrates that intergenerational trauma has behavioural and epigenetic influences that can lead to increased obesity. This scoping review provides a preliminary map of the current literature and understandings of these topics. This review calls for continued studies regarding the connection between trauma, obesity, and epigenetics in Indigenous communities. Future research is vital for practice and policy surrounding individual and communal healing.",Epigenetics
Epigenetic transmission of Holocaust trauma: can nightmares be inherited?,"The Holocaust left its visible and invisible marks not only on the survivors, but also on their children. Instead of numbers tattooed on their forearms, however, they may have been marked epigenetically with a chemical coating upon their chromosomes, which would represent a kind of biological memory of what the parents experienced. as a result, some suffer from a general vulnerability to stress while others are more resilient. Previous research assumed that such transmission was caused by environmental factors, such as the parents' childrearing behavior. New research, however, indicates that these transgenerational effects may have been also (epi) genetically transmitted to their children. Integrating both hereditary and environmental factors, epigenetics adds a new and more comprehensive psychobiological dimension to the explanation of transgenerational transmission of trauma. Specifically, epigenetics may explain why latent transmission becomes manifest under stress. a general theoretical overview of epigenetics and its relevance to research on trauma transmission is presented.",The Israel journal of psychiatry and related sciences
Refusing epigenetics: indigeneity and the colonial politics of trauma.,"Environmental epigenetics is increasingly employed to understand the health outcomes of communities who have experienced historical trauma and structural violence. Epigenetics provides a way to think about traumatic events and sustained deprivation as biological ""exposures"" that contribute to ill-health across generations. In Australia, some Indigenous researchers and clinicians are embracing epigenetic science as a framework for theorising the slow violence of colonialism as it plays out in intergenerational legacies of trauma and illness. However, there is dispute, contention, and caution as well as enthusiasm among these research communities.In this article, we trace strategies of ""refusal"" (Simpson, 2014) in response to epigenetics in Indigenous contexts. Drawing on ethnographic fieldwork conducted in Australia with researchers and clinicians in Indigenous health, we explore how some construct epigenetics as useless knowledge and a distraction from implementing anti-colonial change, rather than a tool with which to enact change. Secondly, we explore how epigenetics narrows definitions of colonial harm through the optic of molecular trauma, reproducing conditions in which Indigenous people are made intelligible through a lens of ""damaged"" bodies. Faced with these two concerns, many turn away from epigenetics altogether, refusing its novelty and supposed benefit for Indigenous health equity and resisting the pull of postgenomics.",History and philosophy of the life sciences
"Stress, cortisol and suicide risk.","Suicide is a global health issue accounting for at least 800,000 deaths per annum. Numerous models have been proposed that differ in their emphasis on the role of psychological, social, psychiatric and neurobiological factors in explaining suicide risk. Central to many models is a stress-diathesis component which states that suicidal behavior is the result of an interaction between acutely stressful events and a susceptibility to suicidal behavior (a diathesis). This article presents an overview of studies that demonstrate that stress and dysregulated hypothalamic-pituitary-adrenal (HPA) axis activity, as measured by cortisol levels, are important additional risk factors for suicide. Evidence for other putative stress-related suicide risk factors including childhood trauma, impaired executive function, impulsivity and disrupted sleep are considered together with the impact of family history of suicide, perinatal and epigenetic influences on suicide risk.",International review of neurobiology
Peripheral nerve injury and myelination: Potential therapeutic strategies.,"Traumatic peripheral nerve injury represents a major clinical and public health problem that often leads to significant functional impairment and permanent disability. Despite modern diagnostic procedures and advanced microsurgical techniques, functional recovery after peripheral nerve repair is often unsatisfactory. Therefore, there is an unmet need for new therapeutic or adjunctive strategies to promote the functional recovery in nerve injury patients. In contrast to the central nervous system, Schwann cells in the peripheral nervous system play a pivotal role in several aspects of nerve repair such as degeneration, remyelination, and axonal growth. Several non-surgical approaches, including pharmacological, electrical, cell-based, and laser therapies, have been employed to promote myelination and enhance functional recovery after peripheral nerve injury. This review will succinctly discuss the potential therapeutic strategies in the context of myelination following peripheral neurotrauma.",Journal of neuroscience research
A review of the genetics and epigenetics of central precocious puberty.,"Gonadotrophin dependent sexual precocity, commonly referred to as central precocious puberty (CPP), results from a premature reactivation of the hypothalamic-pituitary-gonadal (HPG) axis before the normal age of pubertal onset. CPP is historically described as girls who enter puberty before the age of eight, and boys before the age of nine. Females are more likely to be diagnosed with idiopathic CPP; males diagnosed with CPP have a greater likelihood of a defined etiology. These etiologies may include underlying CNS congenital defects, tumors, trauma, or infections as well as environmental, genetic, and epigenetic factors. Recently, genetic variants and mutations which may cause CPP have been identified at both the level of the hypothalamus and the pituitary. Single nucleotide polymorphisms (SNPs), monogenetic mutations, and modifications of the epigenome have been evaluated in relationship to the onset of puberty; these variants are thought to affect the development, structure and function of GnRH neurons which may lead to either precocious, delayed, or absent pubertal reactivation. This review will describe recent advances in the field of the genetic basis of puberty and provide a clinically relevant approach to better understand these varying etiologies of CPP.",Frontiers in endocrinology
Intrinsic mechanisms of neuronal axon regeneration.,"Permanent disabilities following CNS injuries result from the failure of injured axons to regenerate and rebuild functional connections with their original targets. By contrast, injury to peripheral nerves is followed by robust regeneration, which can lead to recovery of sensory and motor functions. This regenerative response requires the induction of widespread transcriptional and epigenetic changes in injured neurons. Considerable progress has been made in recent years in understanding how peripheral axon injury elicits these widespread changes through the coordinated actions of transcription factors, epigenetic modifiers and, to a lesser extent, microRNAs. Although many questions remain about the interplay between these mechanisms, these new findings provide important insights into the pivotal role of coordinated gene expression and chromatin remodelling in the neuronal response to injury.",Nature reviews. Neuroscience
The epigenetics of early life adversity and trauma inheritance: an interview with Moshe Szyf.,"In this interview, Professor Moshe Szyf speaks with Storm Johnson, Commissioning Editor for <i>Epigenomics</i>, on his work to date in the field of social epigenetics. Szyf received his PhD from the Hebrew University and did his postdoctoral fellowship in genetics at Harvard Medical School, joined the Department of Pharmacology and Therapeutics at McGill University in Montreal in 1989 and is a fellow of the Royal Society of Canada and the Academy of Health Sciences of Canada. He is the founding codirector of the Sackler Institute for Epigenetics and Psychobiology at McGill and is a Fellow of the Canadian Institute for Advanced Research Experience-Based Brain and Biological Development program. Szyf was the founder of the first pharma to develop epigenetic pharmacology, Methylgene Inc., and the journal <i>Epigenetics</i>. The Szyf lab proposed two decades ago that DNA methylation is a prime therapeutic target in cancer and other diseases and postulated and provided the first set of evidence that the social environment early in life can alter DNA methylation, launching the emerging field of social epigenetics.",Epigenomics
Epigenetics and gene expression profile in first-episode psychosis: The role of childhood trauma.,"Childhood Trauma (CT) mediation of the epigenome and its impact on gene expression profile could provide a mechanism for the gene-environment interaction underling psychosis. We reviewed the evidence concerning epigenetic and gene expression modifications associated with CT in both First-Episode Psychosis (FEP) and healthy subjects. In order to explore the relative role of psychosis itself in determining these modifications, evidence about FEP and epigenetics/gene expression was also summarized. We performed a systematic search on PubMed, last updated in December 2016. Out of 2966 potentially relevant records, only 41 studies were included. CT resulted associated: in FEP subjects, with global DNA hypo-methylation and reduced BDNF gene-expression; in healthy subjects, with hyper-methylation of SLC6A4, NR3C1, KITLG, and OXTR; hypo-methylation of FKBP5, IL-6, and BDNF; increased IL1B, IL8, and PTGS gene expression; and decreased SLC6A4 gene expression. FEP showed global DNA hypo-methylation; increased methylation and reduced gene expression of GCH1; hyper-expression of MPB, NDEL1, AKT1, and DICER1; and hypo-expression of DROSHA, COMT, and DISC1 in comparison with healthy controls.",Neuroscience and biobehavioral reviews
Establishment of intestinal organoid cultures modeling injury-associated epithelial regeneration.,"The capacity of 3D organoids to mimic physiological tissue organization and functionality has provided an invaluable tool to model development and disease in vitro. However, conventional organoid cultures primarily represent the homeostasis of self-organizing stem cells and their derivatives. Here, we established a novel intestinal organoid culture system composed of 8 components, mainly including VPA, EPZ6438, LDN193189, and R-Spondin 1 conditioned medium, which mimics the gut epithelium regeneration that produces hyperplastic crypts following injury; therefore, these organoids were designated hyperplastic intestinal organoids (Hyper-organoids). Single-cell RNA sequencing identified different regenerative stem cell populations in our Hyper-organoids that shared molecular features with in vivo injury-responsive Lgr5<sup>+</sup> stem cells or Clu<sup>+</sup> revival stem cells. Further analysis revealed that VPA and EPZ6438 were indispensable for epigenome reprogramming and regeneration in Hyper-organoids, which functioned through epigenetically regulating YAP signaling. Furthermore, VPA and EPZ6438 synergistically promoted regenerative response in gut upon damage in vivo. In summary, our results demonstrated a new in vitro organoid model to study epithelial regeneration, highlighting the importance of epigenetic reprogramming that pioneers tissue repair.",Cell research
Inhibition of ferroptosis promotes retina ganglion cell survival in experimental optic neuropathies.,"Retinal ganglion cell (RGC) death is a hallmark of traumatic optic neuropathy, glaucoma, and other optic neuropathies that result in irreversible vision loss. However, therapeutic strategies for rescuing RGC loss still remain challenging, and the molecular mechanism underlying RGC loss has not been fully elucidated. Here, we highlight the role of ferroptosis, a non-apoptotic form of programmed cell death characterized by iron-dependent lethal lipid peroxides accumulation, in RGC death using an experimental model of glaucoma and optic nerve crush (ONC). ONC treatment resulted in significant downregulation of glutathione peroxidase 4 (GPx4) and system xc(-) cystine/glutamate antiporter (xCT) in the rat retina, accompanied by increased lipid peroxide and iron levels. The reduction of GPx4 expression in RGCs after ONC was confirmed by laser-capture microdissection and PCR. Transmission electron microscopy (TEM) revealed alterations in mitochondrial morphology, including increased membrane density and reduced mitochondrial cristae in RGCs after ONC. Notably, the ferroptosis inhibitor ferrostatin-1 (Fer-1) significantly promoted RGC survival and preserved retinal function in ONC and microbead-induced glaucoma mouse models. In addition, compared to the apoptosis inhibitor Z-VAD-FMK, Fer-1 showed better effect in rescuing RGCs death in ONC retinas. Mechanistically, we found the downregulation of GPx4 mainly occurred in the mitochondrial compartment, accompanied by increased mitochondrial reactive oxygen species (ROS) and lipid peroxides. The mitochondria-selective antioxidant MitoTEMPO attenuated RGC loss after ONC, implicating mitochondrial ROS and lipid peroxides as major mechanisms in ferroptosis-induced RGC death in ONC retinas. Notably, administering Fer-1 effectively prevented the production of mitochondrial lipid peroxides, the impairment of mitochondrial adenosine 5'-triphosphate (ATP) production, and the downregulation of mitochondrial genes, such as mt-Cytb and MT-ATP6, in ONC retinas. Our findings suggest that ferroptosis is a major form of regulated cell death for RGCs in experimental glaucoma and ONC models and suggesting targeting mitochondria-dependent ferroptosis as a protective strategy for RGC injuries in optic neuropathies.",Redox biology
Biological underpinnings of trauma and post-traumatic stress disorder: focusing on genetics and epigenetics.,"Certain individuals are more susceptible to stress and trauma, as well as the physical and mental health consequences following such exposure, including risk for post-traumatic stress disorder (PTSD). This differing vulnerability is likely to be influenced by genetic predisposition and specific characteristics of the stress itself (nature, intensity and duration), as well as epigenetic mechanisms. In this review we provide an overview of research findings in this field. We highlight some of the key genetic risk factors identified for PTSD, and the evidence that epigenetic processes might play a role in the biological response to trauma, as well as being potential biomarkers of PTSD risk. We also discuss important considerations for future research in this area.",Epigenomics
Exosomes-Loaded Electroconductive Hydrogel Synergistically Promotes Tissue Repair after Spinal Cord Injury via Immunoregulation and Enhancement of Myelinated Axon Growth.,"Electroconductive hydrogels are very attractive candidates for accelerated spinal cord injury (SCI) repair because they match the electrical and mechanical properties of neural tissue. However, electroconductive hydrogel implantation can potentially aggravate inflammation, and hinder its repair efficacy. Bone marrow stem cell-derived exosomes (BMSC-exosomes) have shown immunomodulatory and tissue regeneration effects, therefore, neural tissue-like electroconductive hydrogels loaded with BMSC-exosomes are developed for the synergistic treatment of SCI. These exosomes-loaded electroconductive hydrogels modulate microglial M2 polarization via the NF-κB pathway, and synergistically enhance neuronal and oligodendrocyte differentiation of neural stem cells (NSCs) while inhibiting astrocyte differentiation, and also increase axon outgrowth via the PTEN/PI3K/AKT/mTOR pathway. Furthermore, exosomes combined electroconductive hydrogels significantly decrease the number of CD68-positive microglia, enhance local NSCs recruitment, and promote neuronal and axonal regeneration, resulting in significant functional recovery at the early stage in an SCI mouse model. Hence, the findings of this study demonstrate that the combination of electroconductive hydrogels and BMSC-exosomes is a promising therapeutic strategy for SCI repair.","Advanced science (Weinheim, Baden-Wurttemberg, Germany)"
Epigenomic Dysregulation in Schizophrenia: In Search of Disease Etiology and Biomarkers.,"Schizophrenia is a severe psychiatric disorder with a complex array of signs and symptoms that causes very significant disability in young people. While schizophrenia has a strong genetic component, with heritability around 80%, there is also a very significant range of environmental exposures and stressors that have been implicated in disease development and neuropathology, such as maternal immune infection, obstetric complications, childhood trauma and cannabis exposure. It is postulated that epigenetic factors, as well as regulatory non-coding RNAs, mediate the effects of these environmental stressors. In this review, we explore the most well-known epigenetic marks, including DNA methylation and histone modification, along with emerging RNA mediators of epigenomic state, including miRNAs and lncRNAs, and discuss their collective potential for involvement in the pathophysiology of schizophrenia implicated through the postmortem analysis of brain tissue. Given that peripheral tissues, such as blood, saliva, and olfactory epithelium have the same genetic composition and are exposed to many of the same environmental exposures, we also examine some studies supporting the application of peripheral tissues for epigenomic biomarker discovery in schizophrenia. Finally, we provide some perspective on how these biomarkers may be utilized to capture a signature of past events that informs future treatment.",Cells
Mechanisms of exercise as a preventative measure to muscle wasting.,"Skeletal muscle is the most abundant tissue in healthy individuals and it has important roles in health beyond voluntary movement. The overall mass and energy requirements of skeletal muscle require it to be metabolically active and flexible to multiple energy substrates. The tissue has evolved to be largely load dependent and it readily adapts in a number of positive ways to repetitive overload, such as various forms of exercise training. However, unloading from extended bed rest and/or metabolic derangements in response to trauma, acute illness, or severe pathology, commonly results in rapid muscle wasting. Decline in muscle mass contributes to multimorbidity, reduces function, and exerts a substantial, negative impact on the quality of life. The principal mechanisms controlling muscle mass have been well described and these cellular processes are intricately regulated by exercise. Accordingly, exercise has shown great promise and efficacy in preventing or slowing muscle wasting through changes in molecular physiology, organelle function, cell signaling pathways, and epigenetic regulation. In this review, we focus on the role of exercise in altering the molecular landscape of skeletal muscle in a manner that improves or maintains its health and function in the presence of unloading or disease.epigenetics; exercise; muscle wasting; resistance training; skeletal muscle.",American journal of physiology. Cell physiology
"Critical Windows: Exploring the Association Between Perinatal Trauma, Epigenetics, and Chronic Pain.","Chronic pain is highly prevalent and burdensome, affecting millions of people worldwide. Although it emerges at any point in life, it often manifests in adolescence. Given that adolescence is a unique developmental period, additional strains associated with persistent and often idiopathic pain lead to significant long-term consequences. While there is no singular cause for the chronification of pain, epigenetic modifications that lead to neural reorganization may underpin central sensitization and subsequent manifestation of pain hypersensitivity. Epigenetic processes are particularly active during the prenatal and early postnatal years. We demonstrate how exposure to various traumas, such as intimate partner violence while in utero or adverse childhood experiences, can significantly influence epigenetic regulation within the brain and in turn modify pain-related processes. We provide compelling evidence that the burden of chronic pain is likely initiated early in life, often being transmitted from mother to offspring. We also highlight two promising prophylactic strategies, oxytocin administration and probiotic use, that have the potential to attenuate the epigenetic consequences of early adversity. Overall, we advance understanding of the causal relationship between trauma and adolescent chronic pain by highlighting epigenetic mechanisms that underlie this transmission of risk, ultimately informing how to prevent this rising epidemic.","The Neuroscientist : a review journal bringing neurobiology, neurology and psychiatry"
A road map for understanding molecular and genetic determinants of osteoporosis.,"Osteoporosis is a highly prevalent disorder characterized by low bone mineral density and an increased risk of fracture, termed osteoporotic fracture. Notably, bone mineral density, osteoporosis and osteoporotic fracture are highly heritable; however, determining the genetic architecture, and especially the underlying genomic and molecular mechanisms, of osteoporosis in vivo in humans is still challenging. In addition to susceptibility loci identified in genome-wide association studies, advances in various omics technologies, including genomics, transcriptomics, epigenomics, proteomics and metabolomics, have all been applied to dissect the pathogenesis of osteoporosis. However, each technology individually cannot capture the entire view of the disease pathology and thus fails to comprehensively identify the underlying pathological molecular mechanisms, especially the regulatory and signalling mechanisms. A change to the status quo calls for integrative multi-omics and inter-omics analyses with approaches in 'systems genetics and genomics'. In this Review, we highlight findings from genome-wide association studies and studies using various omics technologies individually to identify mechanisms of osteoporosis. Furthermore, we summarize current studies of data integration to understand, diagnose and inform the treatment of osteoporosis. The integration of multiple technologies will provide a road map to illuminate the complex pathogenesis of osteoporosis, especially from molecular functional aspects, in vivo in humans.",Nature reviews. Endocrinology
