Title,Abstract,Journal
Global DNA methylation in suicidal ideation and suicide attempt in schizophrenia.,"Suicidal behavior is influenced by many risk factors such as childhood trauma, stressful life events, genetic factors, and severe mental illnesses. Suicidal ideation is present in 50% of schizophrenia patients and is associated with an elevated risk of suicide attempt. Studies have shown that epigenetic mechanisms are associated with suicidal behavior in schizophrenia. Although several studies have suggested the importance of epigenetic factors in suicidal ideation and behavior, no studies have investigated global methylation in association with these two phenotypes. This study investigated global methylation level/change in association with current and emergent suicidal ideation and also with suicide attempt. Forty-seven schizophrenia patients were assessed for the association between global methylation and suicide attempt, and a subsample of these patients (n = 27) was assessed for current suicidal ideation. Afterwards, we performed a longitudinal analysis in which global methylation changes during a 3-month follow-up were compared between patients with and without emergent suicidal ideation. This methylation analysis did not find evidence for a significant association between global methylation and suicidal ideation or suicide attempt. To date, there are no robust biomarkers predicting suicidal ideation or behavior in psychotic patients. This study is the first to investigate global methylation in predicting suicidal ideation and behavior. Although we did not find evidence for an association between global methylation and these phenotypes, our findings may offer novel insights into the molecular mechanisms linked to suicide. Future investigation may measure global methylation in association with suicidal ideation or behavior in larger samples.",Psychiatric genetics
Stress and trauma: BDNF control of dendritic-spine formation and regression.,"Chronic restraint stress leads to increases in brain derived neurotrophic factor (BDNF) mRNA and protein in some regions of the brain, e.g. the basal lateral amygdala (BLA) but decreases in other regions such as the CA3 region of the hippocampus and dendritic spine density increases or decreases in line with these changes in BDNF. Given the powerful influence that BDNF has on dendritic spine growth, these observations suggest that the fundamental reason for the direction and extent of changes in dendritic spine density in a particular region of the brain under stress is due to the changes in BDNF there. The most likely cause of these changes is provided by the stress initiated release of steroids, which readily enter neurons and alter gene expression, for example that of BDNF. Of particular interest is how glucocorticoids and mineralocorticoids tend to have opposite effects on BDNF gene expression offering the possibility that differences in the distribution of their receptors and of their downstream effects might provide a basis for the differential transcription of the BDNF genes. Alternatively, differences in the extent of methylation and acetylation in the epigenetic control of BDNF transcription are possible in different parts of the brain following stress. Although present evidence points to changes in BDNF transcription being the major causal agent for the changes in spine density in different parts of the brain following stress, steroids have significant effects on downstream pathways from the TrkB receptor once it is acted upon by BDNF, including those that modulate the density of dendritic spines. Finally, although glucocorticoids play a canonical role in determining BDNF modulation of dendritic spines, recent studies have shown a role for corticotrophin releasing factor (CRF) in this regard. There is considerable improvement in the extent of changes in spine size and density in rodents with forebrain specific knockout of CRF receptor 1 (CRFR1) even when the glucocorticoid pathways are left intact. It seems then that CRF does have a role to play in determining BDNF control of dendritic spines.",Progress in neurobiology
The body keeps the score: The neurobiological profile of traumatized adolescents.,"Trauma-related disorders are debilitating psychiatric conditions that affect people who have directly or indirectly witnessed adversities. Experiencing multiple types of traumas appears to be common during childhood, and even more so during adolescence. Dramatic brain/body transformations occurring during adolescence may provide a highly responsive substrate to external stimuli and lead to trauma-related vulnerability conditions, such as internalizing (anxiety, depression, anhedonia, withdrawal) and externalizing (aggression, delinquency, conduct disorders) problems. Analyzing relations among neuronal, endocrine, immune, and biochemical signatures of trauma and internalizing and externalizing behaviors, including the role of personality traits in shaping these conducts, this review highlights that the marked effects of traumatic experience on the brain/body involve changes at nearly every level of analysis, from brain structure, function and connectivity to endocrine and immune systems, from gene expression (including in the gut) to the development of personality.",Neuroscience and biobehavioral reviews
Posttraumatic stress disorder: from gene discovery to disease biology.,"Posttraumatic stress disorder (PTSD) is a complex mental disorder afflicting approximately 7% of the population. The diverse number of traumatic events and the wide array of symptom combinations leading to PTSD diagnosis contribute substantial heterogeneity to studies of the disorder. Genomic and complimentary-omic investigations have rapidly increased our understanding of the heritable risk for PTSD. In this review, we emphasize the contributions of genome-wide association, epigenome-wide association, transcriptomic, and neuroimaging studies to our understanding of PTSD etiology. We also discuss the shared risk between PTSD and other complex traits derived from studies of causal inference, co-expression, and brain morphological similarities. The investigations completed so far converge on stark contrasts in PTSD risk between sexes, partially attributed to sex-specific prevalence of traumatic experiences with high conditional risk of PTSD. To further understand PTSD biology, future studies should focus on detecting risk for PTSD while accounting for substantial cohort-level heterogeneity (e.g. civilian v. combat-exposed PTSD cases or PTSD risk among cases exposed to specific traumas), expanding ancestral diversity among study cohorts, and remaining cognizant of how these data influence social stigma associated with certain traumatic events among underrepresented minorities and/or high-risk populations.",Psychological medicine
Diabetes impairs cardioprotective function of endothelial progenitor cell-derived extracellular vesicles via H3K9Ac inhibition.,"<b>Background and Purpose:</b> Myocardial infarction (MI) in diabetic patients results in higher mortality and morbidity. We and others have previously shown that bone marrow-endothelial progenitor cells (EPCs) promote cardiac neovascularization and attenuate ischemic injury. Lately, small extracellular vesicles (EVs) have emerged as major paracrine effectors mediating the benefits of stem cell therapy. Modest clinical outcomes of autologous cell-based therapies suggest diabetes-induced EPC dysfunction and may also reflect their EV derivatives. Moreover, studies suggest that post-translational histone modifications promote diabetes-induced vascular dysfunctions. Therefore, we tested the hypothesis that diabetic EPC-EVs may lose their post-injury cardiac reparative function by modulating histone modification in endothelial cells (ECs). <b>Methods:</b> We collected EVs from the culture medium of EPCs isolated from non-diabetic (db/+) and diabetic (db/db) mice and examined their effects on recipient ECs and cardiomyocytes <i>in vitro,</i> and their reparative function in permanent ligation of left anterior descending (LAD) coronary artery and ischemia/reperfusion (I/R) myocardial ischemic injuries <i>in vivo</i>. <b>Results:</b> Compared to db/+ EPC-EVs, db/db EPC-EVs promoted EC and cardiomyocyte apoptosis and repressed tube-forming capacity of ECs. <i>In vivo</i>, db/db EPC-EVs depressed cardiac function, reduced capillary density, and increased fibrosis compared to db/+ EPC-EV treatments after MI. Moreover, in the I/R MI model, db/+ EPC-EV-mediated acute cardio-protection was lost with db/db EPC-EVs, and db/db EPC-EVs increased immune cell infiltration, infarct area, and plasma cardiac troponin-I. Mechanistically, histone 3 lysine 9 acetylation (H3K9Ac) was significantly decreased in cardiac ECs treated with db/db EPC-EVs compared to db/+ EPC-EVs. The H3K9Ac chromatin immunoprecipitation sequencing (ChIP-Seq) results further revealed that db/db EPC-EVs reduced H3K9Ac level on angiogenic, cell survival, and proliferative genes in cardiac ECs. We found that the histone deacetylase (HDAC) inhibitor, valproic acid (VPA), partly restored diabetic EPC-EV-impaired H3K9Ac levels, tube formation and viability of ECs, and enhanced cell survival and proliferative genes, <i>Pdgfd</i> and <i>Sox12</i>, expression. Moreover, we observed that VPA treatment improved db/db EPC-mediated post-MI cardiac repair and functions. <b>Conclusions:</b> Our findings unravel that diabetes impairs EPC-EV reparative function in the ischemic heart, at least partially, through HDACs-mediated H3K9Ac downregulation leading to transcriptional suppression of angiogenic, proliferative and cell survival genes in recipient cardiac ECs. Thus, HDAC inhibitors may potentially be used to restore the function of diabetic EPC and other stem cells for autologous cell therapy applications.",Theranostics
PTSD and gene variants: new pathways and new thinking.,"Posttraumatic Stress Disorder (PTSD) is an anxiety disorder which can develop as a result of exposure to a traumatic event and is associated with significant functional impairment. Family and twin studies have found that risk for PTSD is associated with an underlying genetic vulnerability and that more than 30% of the variance associated with PTSD is related to a heritable component. Using a fear conditioning model to conceptualize the neurobiology of PTSD, three primary neuronal systems have been investigated - the hypothalamic-pituitary-adrenal axis, the locus coeruleus-noradrenergic system, and neurocircuitry interconnecting the limbic system and frontal cortex. The majority of the initial investigations into main effects of candidate genes hypothesized to be associated with PTSD risk have been negative, but studies examining the interaction of genetic polymorphisms with specific environments in predicting PTSD have produced several positive results which have increased our understanding of the determinants of risk and resilience in the aftermath of trauma. Promising avenues of inquiry into the role of epigenetic modification have also been proposed to explain the enduring impact of environmental exposures which occur during key, often early, developmental periods on gene expression. Studies of PTSD endophenotypes, which are heritable biomarkers associated with a circumscribed trait within the more complex psychiatric disorder, may be more directly amenable to analysis of the underlying genetics and neural pathways and have provided promising targets for elucidating the neurobiology of PTSD. Knowledge of the genetic underpinnings and neuronal pathways involved in the etiology and maintenance of PTSD will allow for improved targeting of primary prevention amongst vulnerable individuals or populations, as well as timely, targeted treatment interventions. This article is part of a Special Issue entitled 'Post-Traumatic Stress Disorder'.",Neuropharmacology
A review of epigenetic contributions  to post-traumatic stress disorder .,"Post-traumatic stress disorder (PTSD) is a syndrome which serves as a classic example of psychiatric disorders that result from the intersection of nature and nurture, or gene and environment. By definition, PTSD requires the experience of a traumatic exposure, and yet data suggest that the risk for PTSD in the aftermath of trauma also has a heritable (genetic) component. Thus, PTSD appears to require both a biological (genetic) predisposition that differentially alters how the individual responds to or recovers from trauma exposure. Epigenetics is defined as the study of changes in organisms caused by modification of gene expression rather than alteration of the genetic code itself, and more recently it has come to refer to direct alteration of DNA regulation, but without altering the primary sequence of DNA, or the genetic code. With regards to PTSD, epigenetics provides one way for environmental exposure to be ""written"" upon the genome, as a direct result of gene and environment (trauma) interactions. This review provides an overview of the main currently understood types of epigenetic regulation, including DNA methylation, histone regulation of chromatin, and noncoding RNA regulation of gene expression. Furthermore, we examine recent literature related to how these methods of epigenetic regulation may be involved in differential risk and resilience for PTSD in the aftermath of trauma. .",Dialogues in clinical neuroscience
Epigenetic aging and PTSD outcomes in the immediate aftermath of trauma.,"Psychological trauma exposure and posttraumatic stress disorder (PTSD) have been associated with advanced epigenetic age. However, whether epigenetic aging measured at the time of trauma predicts the subsequent development of PTSD outcomes is unknown. Moreover, the neural substrates underlying posttraumatic outcomes associated with epigenetic aging are unclear.",Psychological medicine
Epigenetic clocks may come out of rhythm-implications for the estimation of chronological age in forensic casework.,"There is a growing perception that DNA methylation may be influenced by exogenous and endogenous parameters. Knowledge of these factors is of great relevance for the interpretation of DNA-methylation data for the estimation of chronological age in forensic casework. We performed a literature review to identify parameters, which might be of relevance for the prediction of chronological age based on DNA methylation. The quality of age predictions might particularly be influenced by lifetime adversities (chronic stress, trauma/post-traumatic stress disorder (PTSD), violence, low socioeconomic status/education), cancer, obesity and related diseases, infectious diseases (especially HIV and Cytomegalovirus (CMV) infections), sex, ethnicity and exposure to toxins (alcohol, smoking, air pollution, pesticides). Such factors may alter the DNA methylation pattern and may explain the partly high deviations between epigenetic age and chronological age in single cases (despite of low mean absolute deviations) that can also be observed with ""epigenetic clocks"" comprising a high number of CpG sites. So far, only few publications dealing with forensic age estimation address these confounding factors. Future research should focus on the identification of further relevant confounding factors and the development of models that are ""robust"" against the influence of such biological factors by systematic investigations under targeted inclusion of diverse and defined cohorts.",International journal of legal medicine
Trauma context exerts intergenerational effects on child mental health via DNA methylation.,"Many people experience traumatic or negative events, but few develop mental health issues as a result. This study investigated whether newborn DNA methylation (DNAm) previously associated with maternal childhood physical abuse by her father affected the child's mental health and physical growth, as well as whether it mediated or moderated developmental outcomes.",Epigenetics
Potential of microRNAs as novel targets in the alleviation of pathological fear.,"The current treatment of post-traumatic stress disorder (PTSD), phobias and other anxiety disorders, remains insufficient particularly in producing long-lasting full symptom control. Dysfunctional fear processing is common in these disorders, including a deficiency in fear-inhibitory mechanisms and impairment in the ability to discriminate between safety and danger cues. Research has aimed to elucidate brain circuitries, neurotransmitters and downstream signaling pathways important in the alleviation of aberrant fear, with a specific focus on mechanisms modulating fear memory and its behavioral expression. MicroRNAs (miRNA) as ""fine tuners"" of gene expression at the post-transcriptional level have emerged as critical regulators of such mechanisms important in both, the generation and the inhibition of fear memories. Along these lines, abnormal expression of miRNAs has been associated with different fear-related disorders. After providing an updated overview on the involvement of miRNAs in fear learning mechanisms, we summarize and discuss in particular those studies in which the implication of miRNAs in successful inhibition of fear has been explored. For a better overview, we dissociate the different modes of fear alleviation investigated in this regard and present studies in rodents demonstrating that specific miRNAs are involved in the destabilization of fear by interfering with consolidation/reconsolidation mechanisms or that they are associated with the generation of fear extinction or safety learning. Finally, we discuss the potential of miRNAs as biomarkers and novel therapeutic targets, as well as the challenges involved in applying the discovered mechanisms in the development of improved treatments of fear- and trauma-related disorders.","Genes, brain, and behavior"
Potential Societal and Cultural Implications of Transgenerational Epigenetic Methylation of Trauma and PTSD: Pathology or Resilience?,"Psychological trauma is unique in that it is an environmental event that could induce biological changes and post-traumatic stress disorder (PTSD), depression, or other mood disorders in some patients. On the other hand, there may be no psychopathology (in most cases), or even sometimes post-traumatic growth and resilience. According to the DSM-5, trauma is a prerequisite for PTSD and traumatic stress disorder, but not for depressive episodes or mood disorders, or other psychiatric conditions. This paper brings attention to the preliminary literature on transgenerational inheritance due to trauma exposure and its societal and cultural implications. There is accumulating evidence that exposure to trauma can be passed transgenerationally through epigenetic inheritance leading to changes in gene expression and possible disorders or resilience. The effects of resilience from transgenerational inheritance have not been studied, but should be, for a full understanding not only of the disease risk across generations, but also of its social and cultural implications. The epigenetic pathologic effects across generations also need further studies, as the current research is preliminary; larger replications are needed for definitive and more complete understanding. I present here a glimpse of where we are, a vision of where we should go in terms of future research direction for disease risk transmission, and recommend studies of resilience and post-traumatic growth across generations, as well as other studies related to the societal implications at the population level.",The Yale journal of biology and medicine
"The Effects of Trauma, with or without PTSD, on the Transgenerational DNA Methylation Alterations in Human Offsprings.","Exposure to psychological trauma is a strong risk factor for several debilitating disorders including post-traumatic stress disorder (PTSD) and depression. Besides the impact on mental well-being and behavior in the exposed individuals, it has been suggested that psychological trauma can affect the biology of the individuals, and even have biological and behavioral consequences on the offspring of exposed individuals. While knowledge of possible epigenetic underpinnings of the association between exposure to trauma and risk of PTSD has been discussed in several reviews, it remains to be established whether trauma-induced epigenetic modifications can be passed from traumatized individuals to subsequent generations of offspring. The aim of this paper is to review the emerging literature on evidence of transgenerational inheritance due to trauma exposure on the epigenetic mechanism of DNA methylation in humans. Our review found an accumulating amount of evidence of an enduring effect of trauma exposure to be passed to offspring transgenerationally via the epigenetic inheritance mechanism of DNA methylation alterations and has the capacity to change the expression of genes and the metabolome. This manuscript summarizes and critically reviews the relevant original human studies in this area. Thus, it provides an overview of where we stand, and a clearer vision of where we should go in terms of future research directions.",Brain sciences
Emerging trends in epigenetic and childhood trauma: Bibliometrics and visual analysis.,"The epigenetic study of childhood trauma has become a valuable field. However, the evolution and emerging trends in epigenetics and childhood trauma have not been studied by bibliometric methods.",Frontiers in psychiatry
Experiences of Trauma and DNA Methylation Profiles among African American Mothers and Children.,"Potentially traumatic experiences have been associated with chronic diseases. Epigenetic mechanisms, including DNA methylation (DNAm), have been proposed as an explanation for this association. We examined the association of experiences of trauma with epigenome-wide DNAm among African American mothers (<i>n</i> = 236) and their children aged 3-5 years (<i>n</i> = 232; N = 500), using the Life Events Checklist-5 (LEC) and Traumatic Events Screening Inventory-Parent Report Revised (TESI-PRR). We identified no DNAm sites significantly associated with potentially traumatic experience scores in mothers. One CpG site on the <i>ENOX1</i> gene was methylome-wide-significant in children (FDR-corrected q-value = 0.05) from the TESI-PRR. This protein-coding gene is associated with mental illness, including unipolar depression, bipolar, and schizophrenia. Future research should further examine the associations between childhood trauma, DNAm, and health outcomes among this understudied and high-risk group. Findings from such longitudinal research may inform clinical and translational approaches to prevent adverse health outcomes associated with epigenetic changes.",International journal of molecular sciences
Gene-based mediation analysis in epigenetic studies.,"Mediation analysis has been a useful tool for investigating the effect of mediators that lie in the path from the independent variable to the outcome. With the increasing dimensionality of mediators such as in (epi)genomics studies, high-dimensional mediation model is needed. In this work, we focus on epigenetic studies with the goal to identify important DNA methylations that act as mediators between an exposure disease outcome. Specifically, we focus on gene-based high-dimensional mediation analysis implemented with kernel principal component analysis to capture potential nonlinear mediation effect. We first review the current high-dimensional mediation models and then propose two gene-based analytical approaches: gene-based high-dimensional mediation analysis based on linearity assumption between mediators and outcome (gHMA-L) and gene-based high-dimensional mediation analysis based on nonlinearity assumption (gHMA-NL). Since the underlying true mediation relationship is unknown in practice, we further propose an omnibus test of gene-based high-dimensional mediation analysis (gHMA-O) by combing gHMA-L and gHMA-NL. Extensive simulation studies show that gHMA-L performs better under the model linear assumption and gHMA-NL does better under the model nonlinear assumption, while gHMA-O is a more powerful and robust method by combining the two. We apply the proposed methods to two datasets to investigate genes whose methylation levels act as important mediators in the relationship: (1) between alcohol consumption and epithelial ovarian cancer risk using data from the Mayo Clinic Ovarian Cancer Case-Control Study and (2) between childhood maltreatment and comorbid post-traumatic stress disorder and depression in adulthood using data from the Gray Trauma Project.",Briefings in bioinformatics
