Title,Abstract,Journal
"Alcohol consumption, depression, overweight and cortisol levels as determining factors for NR3C1 gene methylation.","The NR3C1 glucocorticoid receptor (GR) gene is a component of the stress response system, which can be regulated by epigenetic mechanisms. NR3C1 methylation has been associated with trauma and mental issues, including depression, post-traumatic stress, anxiety, and personality disorders. Previous studies have reported that stressful events are involved in NR3C1 gene methylation, suggesting that its regulation under environmental effects is complex. The present study aimed to analyze associations involving stressors such as socioeconomic status, health conditions, and lifestyle in relation to NR3C1 methylation in adults. This study included 386 individual users of the Brazilian Public Unified Health System (SUS), and evaluated socioeconomic and health conditions, body mass index, cortisol levels, and lifestyle. Data were correlated with NR3C1 methylation, determined using DNA pyrosequencing. The results showed that alcohol consumption, overweight, and high cortisol levels were related to NR3C1 demethylation, while depression was related to its methylation. Habits, lifestyle, and health status may influence NR3C1 gene regulation via methylation, revealing the complexity of environmental impacts on NR3C1 methylation.",Scientific reports
Mechanisms of Epigenetic Inheritance in Post-Traumatic Stress Disorder.,"Post-traumatic stress disorder (PTSD) is a psychiatric disorder that causes debilitating functional impairment in patients. Observations from survivors of traumatic historical events solidify that this disease is not only associated with personal experiences but can also be inherited from familial traumas. Over the past decades, researchers have focused on epigenetic inheritance to understand how responses to adverse experiences can be passed down to future generations. This review aims to present recent findings on epigenetic markers related to PTSD and research in the intergenerational inheritance of trauma. By understanding the information, we hope that epigenetic markers can act as biochemical measurements for future clinical practice.","Life (Basel, Switzerland)"
"Adverse Childhood Experience, Genes, and PTSD Risk in Soldiers: A Methylation Study.","Epigenetics can serve as a marker of susceptibility to many known psychiatric diseases. DNA methylation patterns of multiple genes have been studied in both civilian populations and military personnel with post-traumatic stress disorder (PTSD). Many of these genes serve various functions that span the hypothalamic-pituitary-adrenal axis, immune system, and central nervous system (CNS) growth factors and neurotransmission. It is thought that the methylation levels of such genes may be able to identify individuals who are at higher risk of developing PTSD. Our study seeks to establish whether previously reported PTSD genes possess a particular methylation pattern that is predictive of PTSD in active duty military members with combat exposure.",Military medicine
Impaired cortical neuronal homeostasis and cognition after diffuse traumatic brain injury are dependent on microglia and type I interferon responses.,"Neuropsychiatric complications including depression and cognitive decline develop in the years after traumatic brain injury (TBI), negatively affecting quality of life. Microglial and type 1 interferon (IFN-I) responses are associated with the transition from acute to chronic neuroinflammation after diffuse TBI in mice. Thus, the purpose of this study was to determine if impaired neuronal homeostasis and increased IFN-I responses intersected after TBI to cause cognitive impairment. Here, the RNA profile of neurons and microglia after TBI (single nucleus RNA-sequencing) with or without microglia depletion (CSF1R antagonist) was assessed 7 dpi. There was a TBI-dependent suppression of cortical neuronal homeostasis with reductions in CREB signaling, synaptogenesis, and synaptic migration and increases in RhoGDI and PTEN signaling (Ingenuity Pathway Analysis). Microglial depletion reversed 50% of TBI-induced gene changes in cortical neurons depending on subtype. Moreover, the microglial RNA signature 7 dpi was associated with increased stimulator of interferon genes (STING) activation and IFN-I responses. Therefore, we sought to reduce IFN-I signaling after TBI using STING knockout mice and a STING antagonist, chloroquine (CQ). TBI-associated cognitive deficits in novel object location and recognition (NOL/NOR) tasks at 7 and 30 dpi were STING dependent. In addition, TBI-induced STING expression, microglial morphological restructuring, inflammatory (Tnf, Cd68, Ccl2) and IFN-related (Irf3, Irf7, Ifi27) gene expression in the cortex were attenuated in STING<sup>KO</sup> mice. CQ also reversed TBI-induced cognitive deficits and reduced TBI-induced inflammatory (Tnf, Cd68, Ccl2) and IFN (Irf7, Sting) cortical gene expression. Collectively, reducing IFN-I signaling after TBI with STING-dependent interventions attenuated the prolonged microglial activation and cognitive impairment.",Glia
The role of brain-derived neurotrophic factor in the pathophysiology of suicidal behavior.,"Suicidal behaviour is a major public health concern. It is known that the pathogenesis of suicidal behaviour involves altered neural plasticity, resulting in the aberrant stress response of the central nervous system to environmental factors. Indeed, altered brain structure and function was found in suicide victims. Neurotrophins are growth factors that are involved in the regulation of structural, synaptic, and morphological plasticity and in the modulation of the strength and number of synaptic connections and neurotransmission. Brain-derived neurotrophic factor (BDNF) the most studied and the most widely distributed among neurotrophins binds to a tropomyosin-related kinase B (TrkB) receptor and to a pan75 neurotrophins receptor. It has been reported that BDNF production is decreased in all patients with suicidal behaviour and in all suicide victims regardless of a psychiatric diagnosis. It was also found that the mRNA and protein level of BDNF was significantly lower in both the prefrontal cortex and the hippocampus of suicide subjects. Different mechanisms could be involved in the regulation of BDNF gene expression, among which epigenetic mechanisms seem to play a key role. However, also for a functional polymorphism (rs6265) Val66Metit has been shown that the Met allele is associated with the reduced BDNF activity. Further, a recent meta-analysis including 12 studies showed a trend for the Met-carrying genotypes and Met allele conferring risk for suicide. Among included studies, our study with the largest sample size, indicated that the combined Met/Met and Met/Val genotypes of the BDNF Val66Met variant could be the risk factor for violent suicide in female subjects and for suicide in victims exposed to childhood trauma. In accordance with previous reports, our findings demonstrate that aberrant regulation of BDNF synthesis is associated with suicidal behaviour.",Psychiatria Danubina
Expression of the PPM1F Gene Is Regulated by Stress and Associated With Anxiety and Depression.,"Molecular mechanisms underlying psychological sequelae of exposure to stressful experiences, such as posttraumatic stress disorder (PTSD) and depression, are not well understood.",Biological psychiatry
[Bipolar disorder: a multifactorial disease].,"Bipolar disorder is a multifactorial disease with a strong genetic component. However, environmental factors also play a role in the onset of the disease and in manic and depressive recurrence. The onset of the disorder is the consequence of a complex interaction between genetic and environmental factors. This gene-environment interaction is well illustrated by the influence of childhood trauma on the clinical expression of the disease in terms of age of onset, comorbidity and suicide. The complexity and heterogeneity of bipolar disorder require the identification of homogenous sub-groups with the use of biomarkers that could help reduce the etiological heterogeneity and better target the therapeutical options.",Revue medicale de Liege
Evaluating the impact of trauma and PTSD on epigenetic prediction of lifespan and neural integrity.,"Post-traumatic stress disorder (PTSD) is a debilitating disorder that develops in some people following trauma exposure. Trauma and PTSD have been associated with accelerated cellular aging. This study evaluated the effect of trauma and PTSD on accelerated GrimAge, an epigenetic predictor of lifespan, in traumatized civilians. This study included 218 individuals with current PTSD, 427 trauma-exposed controls without any history of PTSD and 209 subjects with lifetime PTSD history who are not categorized as current PTSD cases. The Traumatic Events Inventory (TEI) and Clinician-Administered PTSD Scale (CAPS) were used to measure lifetime trauma burden and PTSD, respectively. DNA from whole blood was interrogated using the MethylationEPIC or HumanMethylation450 BeadChips. GrimAge estimates were calculated using the methylation age calculator. Cortical thickness of 69 female subjects was assessed by using T1-weighted structural MRI images. Associations between trauma exposure, PTSD, cortical thickness, and GrimAge acceleration were tested with multiple regression models. Lifetime trauma burden (p = 0.03), current PTSD (p = 0.02) and lifetime PTSD (p = 0.005) were associated with GrimAge acceleration, indicative of a shorter predicted lifespan. The association with lifetime PTSD was replicated in an independent cohort (p = 0.04). In the MRI sub sample, GrimAge acceleration also associated with cortical atrophy in the right lateral orbitofrontal cortex (p<sub>adj</sub> = 0.03) and right posterior cingulate (p<sub>adj</sub> = 0.04), brain areas associated with emotion-regulation and threat-regulation. Our findings suggest that lifetime trauma and PTSD may contribute to a higher epigenetic-based mortality risk. We also demonstrate a relationship between cortical atrophy in PTSD-relevant brain regions and shorter predicted lifespan.",Neuropsychopharmacology : official publication of the American College of Neuropsychopharmacology
Childhood maltreatment and HPA axis gene expression in bipolar disorders: A gene network analysis.,"Bipolar disorder (BD) is highly associated with childhood maltreatment (CM), the exposure to such early adversity being suggested to disrupt the expression of several biological pathways. This study aims at exploring associations between the mRNA levels of 9 HPA axis genes in lymphoblastoid cell lines from patients with BD according to their self-reported exposure to CM.",Psychoneuroendocrinology
Dynamic Patterns of Threat-Associated Gene Expression in the Amygdala and Blood.,"Stress and trauma profoundly influence psychiatric biobehavioral outcomes. The identification of treatment and biomarker targets would be accelerated by a broad understanding of the biological responses to these events. The goal of this study was to determine genes responsive to auditory fear conditioning (FC), a well-characterized amygdala-dependent rodent model of threat-exposure, in the presence or absence of prior stress history, providing insight into the physiological processes underlying response to trauma. RNA-sequencing was performed in blood and amygdala from mice that underwent fear conditioning with (Immo+FC) and without (FC) prior immobilization stress, a paradigm that induces HPA axis, and behavioral stress sensitization. In the amygdala, 607 genes were regulated by FC vs. home-cage (HC) controls, and 516 genes differed in stress-sensitized mice (Immo+FC vs. FC). In the former, we observed an enhancement of specific biological processes involved in learning and synaptic transmission, and in the latter processes associated with cell proliferation and the cellular response to drugs. In the blood of stress-sensitized animals, 468 genes were dynamically regulated when compared to FC, and were enriched for the biological pathways of inflammation and cytokine signaling. This study identified genes and pathways that respond to threat in the amygdala and blood of mice with and without a prior stress history and reveals the impact of stress history on subsequent inflammation. Future studies will be needed to examine the role of these dynamically regulated genes may play in human clinical stress and trauma-related disorders.",Frontiers in psychiatry
Gut Microbiota Regulates Epigenetic Remodelling in the Amygdala: A Role in Repeated Mild Traumatic Brain Injury (rMTBI)-Induced Anxiety.,"Gut microbiota serves in the development and maintenance of phenotype. However, the underlying mechanisms are still in its infancy. The current study shows epigenetic remodelling in the brain as a causal mechanism in the gut microbiota-brain axis. Like in trauma patients, gut dysbiosis and anxiety were comorbid in adult male Wistar rats subjected to repeated mild traumatic brain injuries (rMTBI). rMTBI caused epigenetic dysregulation of brain-derived neurotrophic factor (Bdnf) expression in the amygdala, owing to the formation of transcriptional co-repressor complex due to dynamic interaction between histone deacetylase and DNA methylation modification at the Bdnf gene promoter. The probiosis after faecal microbiota transplantation (FMT) from healthy naïve rats or by administration of single strain probiotic (SSP), Lactobacillus rhamnosus GG (LGG), recuperated rMTBI-induced anxiety. Concurrently, LGG infusion or naïve FMT also dislodged rMTBI-induced co-repressor complex resulting in the normalization of Bdnf expression and neuronal plasticity as measured by Golgi-Cox staining. Furthermore, sodium butyrate, a short-chain fatty acid, produced neurobehavioural effects similar to naïve FMT or LGG administration. Interestingly, the gut microbiota from rMTBI-exposed rats per se was able to provoke anxiety in naïve rats in parallel with BDNF deficits. Therefore, gut microbiota seems to be causally linked with the chromatin remodelling necessary for neuroadaptations via neuronal plasticity which drives experience-dependent behavioural manifestations.",Molecular neurobiology
C-Reactive Protein: Marker of risk for post-traumatic stress disorder and its potential for a mechanistic role in trauma response and recovery.,"Increasing evidence indicates that inflammation plays a role in PTSD and stress disorder pathophysiology. PTSD is consistently associated with higher circulating inflammatory protein levels. Rodent models demonstrate that inflammation promotes enduring avoidance and arousal behaviors after severe stressors (e.g., predator exposure and social defeat), suggesting that inflammation may play a mechanistic role in trauma disorders. C-reactive protein (CRP) is an innate acute phase reactant produced by the liver after acute infection and chronic disease. A growing number of investigations report associations with PTSD diagnosis and elevated peripheral CRP, CRP gene mutations, and CRP gene expression changes in immune signaling pathways. CRP is reasonably established as a potential marker of PTSD and trauma exposure, but if and how it may play a mechanistic role is unclear. In this review, we discuss the current understanding of immune mechanisms in PTSD with a particular focus on the innate immune signaling factor, CRP. We found that although there is consistent evidence of an association of CRP with PTSD symptoms and risk, there is a paucity of data on how CRP might contribute to CNS inflammation in PTSD, and consequently, PTSD symptoms. We discuss potential mechanisms through which CRP could modulate enduring peripheral and CNS stress responses, along with future areas of investigation probing the role of CRP and other innate immune signaling factors in modulating trauma responses. Overall, we found that CRP likely contributes to central inflammation, but how it does so is an area for further study.",The European journal of neuroscience
Gene expression associated with PTSD in World Trade Center responders: An RNA sequencing study.,"The gene expression approach has provided promising insights into the pathophysiology of posttraumatic stress disorder (PTSD). However, few studies used hypothesis-free transcriptome-wide approach to comprehensively understand gene expression underpinning PTSD. A transcriptome-wide expression study using RNA sequencing of whole blood was conducted in 324 World Trade Center responders (201 with never, 81 current, 42 past PTSD). Samples from current and never PTSD reponders were randomly split to form discovery (N = 195) and replication (N = 87) cohorts. Differentially expressed genes were used in pathway analysis and to create a polygenic expression score. There were 448 differentially expressed genes in the discovery cohort, of which 99 remained significant in the replication cohort, including FKBP5, which was found to be up-regulated in current PTSD regardless of the genotypes. Several enriched biological pathways were found, including glucocorticoid receptor signaling and immunity-related pathways, but these pathways did not survive FDR correction. The polygenic expression score computed by aggregating 30 differentially expressed genes using the elastic net algorithm achieved sensitivity/specificity of 0.917/0.508, respectively for identifying current PTSD in the replication cohort. Polygenic scores were similar in current and past PTSD, with both groups scoring higher than trauma-exposed controls without any history of PTSD. Together with the pathway analysis results, these findings point to HPA-axis and immune dysregulation as key biological processes underpinning PTSD. A novel polygenic expression aggregate that differentiates PTSD patients from trauma-exposed controls might be a useful screening tool for research and clinical practice, if replicated in other populations.",Translational psychiatry
Interaction between COMT Val<sup>158</sup> Met polymorphism and childhood trauma predicts risk for depression in men.,"Depression is a disabling illness with complex etiology. While the catechol-O-methyltransferase (COMT) gene, in particular the functional Val<sup>158</sup> Met polymorphism, has been related to depression, the mechanisms underlying this gene-disease association are not completely understood. Therefore, we explore the association of COMT Val<sup>158</sup> Met polymorphism with depression as well as its interaction with childhood trauma in 1136 young adults from a population-based study carried out in the city of Pelotas, Brazil. The diagnosis was performed through the Mini International Neuropsychiatric Interview 5.0 (MINI 5.0), and trauma was assessed with the Childhood Trauma Questionnaire (CTQ). Total DNA was extracted and genotyped by real-time PCR, and the QTLbase dataset was queried to perform large-scale quantitative trait locus (QTL) analysis. Our research showed no direct association between the Val<sup>158</sup> Met polymorphism and the diagnosis of depression (women: χ<sup>2</sup>  = 0.10, d = 1, p = 0.751; men: χ<sup>2</sup>  = 0.003, df = 1, p = 0.956). However, the Met-allele of the Val<sup>158</sup> Met polymorphism modified the effect of childhood trauma in men (OR = 2.58 [95% CI: 1.05-6.29]; p = 0.038) conferring risk for depression only on those who suffer from trauma. The conditional effect from moderation analysis showed that trauma impacts the risk of depression only in men carrying the Met-allele (effect: 0.9490, standard error [SE]: 0.2570; p = 0.0002). QTLbase and dataset for Val<sup>158</sup> Met polymorphism were consistent for markers that influence chromatin accessibility transcription capacity including histone methylation and acetylation. The changes caused in gene regulation by childhood trauma exposure and polymorphism may serve as evidence of the mechanism whereby the interaction increases susceptibility to this disorder in men.",International journal of developmental neuroscience : the official journal of the International Society for Developmental Neuroscience
The role of genes in defining a molecular biology of PTSD.,"Because environmental exposure to trauma is the sine qua non for the development of Post Traumatic Stress Disorder (PTSD), the recent focus on genetic studies has been noteworthy. The main catalyst for such studies is the observation from epidemiological studies that not all trauma survivors develop this disorder. Furthermore, neuroendocrine findings suggest pre-existing hormonal alterations that confer risk for PTSD. This paper presents the rationale for examining genetic factors in PTSD and trauma exposure, but suggests that studies of genotype may only present a limited picture of the molecular biology of this disorder. We describe the type of information that can be obtained from candidate gene and genomic studies that incorporate environmental factors in the design (i.e., gene - environment interaction and gene-environment correlation studies) and studies that capitalize on the idea that environment modifies gene expression, via epigenetic or other molecular mechanisms. The examination of epigenetic mechanisms in tandem with gene expression will help refine models that explain how PTSD risk, pathophysiology, and recovery is mediated by the environment. Since inherited genetic variation may also influence the extent of epigenetic or gene expression changes resulting from the environment, such studies should optimally be followed up by studies of genotype.",Disease markers
Epigenetic and Coping Mechanisms of Stress in Affective Disorders: A Scoping Review.,"This review aims to explore the intricate relationship among epigenetic mechanisms, stress, and affective disorders, focusing on how early life experiences and coping mechanisms contribute to susceptibility to mood disorders. Epigenetic factors play a crucial role in regulating gene expression without altering the DNA (deoxyribonucleic acid) sequence, and recent research has revealed associations between epigenetic changes and maladaptive responses to stress or psychiatric disorders. A scoping review of 33 studies employing the PRISMA-S (Preferred Reporting Items for Systematic Reviews and Meta-Analyses-Statement) guidelines investigates the role of stress-induced epigenetic mechanisms and coping strategies in affective disorder occurrence, development, and progression. The analysis encompasses various stress factors, including childhood trauma, work-related stress, and dietary deficiencies, alongside epigenetic changes, such as DNA methylation and altered gene expression. Findings indicate that specific stress-related genes frequently exhibit epigenetic changes associated with affective disorders. Moreover, the review examines coping mechanisms in patients with bipolar disorder and major depressive disorder, revealing mixed associations between coping strategies and symptom severity. While active coping is correlated with better outcomes, emotion-focused coping may exacerbate depressive or manic episodes. Overall, this review underscores the complex interplay among genetic predisposition, environmental stressors, coping mechanisms, and affective disorders. Understanding these interactions is essential for developing targeted interventions and personalized treatment strategies for individuals with mood disorders. However, further research is needed to elucidate specific genomic loci involved in affective disorders and the clinical implications of coping strategies in therapeutic settings.","Medicina (Kaunas, Lithuania)"
DNA methylation under the major depression pathway predicts pediatric quality of life four-month post-pediatric mild traumatic brain injury.,"Major depression has been recognized as the most commonly diagnosed psychiatric complication of mild traumatic brain injury (mTBI). Moreover, major depression is associated with poor outcomes following mTBI; however, the underlying biological mechanisms of this are largely unknown. Recently, genomic and epigenetic factors have been increasingly implicated in the recovery following TBI.",Clinical epigenetics
Altered DNA Methylation of the Serotonin Transporter Gene Associated with Early Life Stress and White Matter Microalterations in Korean Patients with Panic Disorder.,Changes in the DNA methylation of 5-HTTLPR are associated with the pathophysiology of panic disorder (PD). This study was conducted to investigate the association between stressful life events and the level of 5-HTTLPR methylation in patients with PD. We also examined whether these factors were associated with white matter alterations in psychological trauma-related regions.,Neuropsychobiology
