Title,Abstract,Journal
Role of MicroRNAs in Anxiety and Anxiety-Related Disorders.,"MicroRNAs as critical regulators of gene expression important for functions including neuronal development, synapse formation, and synaptic plasticity have been linked with the regulation of neurobiological systems that underlie anxiety processing in the brain. In this chapter, we give an update on associative evidence linking regulation of microRNAs with anxiety- and trauma-related disorders. Moving beyond correlative research, functional studies have emerged recently that explore causal relationships between microRNA expression and anxiety-like behavior. It has been demonstrated that experimental up- or downregulation of the candidate microRNAs in important nodes of the anxiety neurocircuitry can indeed modulate anxiety-related behavior in animal models. Improved methodologies for assessing microRNA-mediated modulation have aided such functional studies, revealing a number of anxiety-regulating microRNAs including miR-15a, miR-17-92, miR-34, miR-101, miR-124, miR-135, and miR-155. Important functional target genes of these identified microRNAs are associated with specific neurotransmitter/neuromodulator signaling, neurotrophin (e.g., BDNF) expression and other aspects of synaptic plasticity, as well as with stress-regulatory/hypothalamic-pituitary-axis function. Furthermore, microRNAs have been revealed that are regulated in distinct brain regions following various anxiety-attenuating strategies. These include pharmacological treatments such as antidepressants and other drugs, as well as non-pharmacological interventions such as fear extinction/exposure therapy or positive stimuli such as exposure to environmental enrichment. These are first indications for a role for microRNAs in the mechanism of action of anxiolytic treatments. As research continues, there is much hope that a deeper understanding of the microRNA-mediated mechanisms underlying anxiety-related disorders could open up possibilities for future novel biomarker and treatment strategies.",Current topics in behavioral neurosciences
Oxytocin receptor DNA methylation in postpartum depression.,"The oxytocin receptor (OXTR) is a key regulator of stress and anxiety and may be regulated by both psychosocial risk factors and gonadal hormones, making it an attractive candidate for study in postpartum depression (PPD). The objective of this study was to investigate both serum hormone and PPD specific DNA methylation variation in the OXTR. Illumina HM450 microarray data generated in a prospective PPD cohort identified significant associations (P=0.014) with PPD in an intronic region in the OXTR located 4bp proximal to an estrogen receptor (ER) binding region. Pyrosequencing confirmed moderate evidence for an interaction of CpGs in the region with childhood abuse status to mediate PPD. These CpGs located on chr3 at positions 8810078 and 8810069 exhibited significant associations with postpartum depression scores from an independent cohort of 240 women with no prior psychiatric history. Hormone analysis suggested a PPD specific negative correlation of DNA methylation in the region with serum estradiol levels. Estradiol levels and OXTR DNA methylation exhibited a significant interaction to associate with the ratio of allopregnanolone to progesterone. Cumulatively, the data corroborate our previous hypotheses of a PPD specific increased sensitivity of epigenetic reprogramming at estrogen target genes and suggests that OXTR epigenetic variation may be an important mediator of mood relevant neuroactive steroid production.",Psychoneuroendocrinology
Childhood trauma in mood disorders: Neurobiological mechanisms and implications for treatment.,"A contemporary model for the pathogenesis of mood disorders (bipolar and depressive disorders) involves gene-environmental interaction, with genetic predisposition, epigenetic regulation, and environmental effects. Among multiple environmental factors, the experience of childhood trauma can be connected with the pathogenesis, course and the treatment of mood disorders. Patients with mood disorders have the greater frequency of childhood trauma compared with the general population, and adverse childhood experiences can exert a negative impact on their clinical course. In this article, the neurobiological mechanisms of childhood trauma are presented. The influence of negative childhood experiences on the central nervous system can result in many structural and functional changes of the brain, including such structures as hippocampus and amygdala, associated with the development of bipolar and depressive illnesses. Interaction of several genes with childhood trauma to produce pathological, clinical phenomena in adulthood has been demonstrated, the most important in this respect being the serotonin transporter gene and the FKBP5 gene playing an important role in the pathogenesis of mood disorders. Neurobiological effects can also involve epigenetic mechanisms such as DNA methylation which can exert an effect on brain function over long-term periods. Somatic effects of childhood trauma include disturbances of stress axis and immune-inflammatory mechanisms as well as metabolic dysregulation. Negative childhood experiences may also bear implications for the treatment of mood disorders. In the article, the impact of such experiences on the treatment of mood disorders will be discussed, especially in the context of treatment -resistance to antidepressants and mood-stabilizing drugs.",Pharmacological reports : PR
"Depression, perceived stress, and distress during pregnancy and EV-associated miRNA profiles in MADRES.","MicroRNA (miRNA) circulating in plasma has been proposed as biomarkers for a variety of diseases and stress measures, including depression, stress, and trauma. However, few studies have examined the relationship between stress and miRNA during pregnancy.",Journal of affective disorders
Intergenerational trauma is associated with expression alterations in glucocorticoid- and immune-related genes.,"Offspring of trauma survivors are more likely to develop PTSD, mood, and anxiety disorders and demonstrate endocrine and molecular alterations compared to controls. This study reports the association between parental Holocaust exposure and genome-wide gene expression in peripheral blood mononuclear cells (PBMC) from 77 Holocaust survivor offspring and 15 comparison subjects. Forty-two differentially expressed genes (DEGs) were identified in association with parental Holocaust exposure (FDR-adjusted p < 0.05); most of these genes were downregulated and co-expressed in a gene network related to immune cell functions. When both parental Holocaust exposure and maternal age at Holocaust exposure shared DEGs, fold changes were in the opposite direction. Similarly, fold changes of shared DEGs associated with maternal PTSD and paternal PTSD were in opposite directions, while fold changes of shared DEGs associated with both maternal and paternal Holocaust exposure or associated with both maternal and paternal age at Holocaust exposure were in the same direction. Moreover, the DEGs associated with parental Holocaust exposure were enriched for glucocorticoid-regulated genes and immune pathways with some of these genes mediating the effects of parental Holocaust exposure on C-reactive protein. The top gene across all analyses was MMP8, encoding the matrix metalloproteinase 8, which is a regulator of innate immunity. To conclude, this study identified a set of glucocorticoid and immune-related genes in association with parental Holocaust exposure with differential effects based on parental exposure-related factors.",Neuropsychopharmacology : official publication of the American College of Neuropsychopharmacology
The role of DNA methylation in stress-related psychiatric disorders.,"Epigenetic modifications in response to traumatic experience and stress are emerging as important factors in the long-term biological trajectories leading to stress-related psychiatric disorders, reflecting both environmental influences as well as individual genetic predisposition. In particular, recent evidence on DNA methylation changes within distinct genes and pathways but also on a genome-wide level provides new insights into the pathophysiology of stress related psychiatric disorders. This review summarizes current findings and concepts on DNA methylation changes in stress-related disorders with a focus on major depressive disorder and posttraumatic stress disorder (PTSD). We highlight studies of DNA methylation in animals and humans pertinent to these disorders, both focusing on candidate loci as well as genome-wide studies. We describe molecular mechanisms of how exposure to stress can induce long lasting changes in DNA methylation and how these may relate to the pathophysiology of depression and PTSD. We discuss data suggesting that DNA methylation, even in peripheral tissues, appears to be an informative reflection of environmental exposures on the genome and may have potential as a biomarker for the early prevention of stress-related disorders.",Neuropharmacology
Traumatic stress and accelerated DNA methylation age: A meta-analysis.,"Recent studies examining the association between posttraumatic stress disorder (PTSD) and accelerated aging, as defined by DNA methylation-based estimates of cellular age that exceed chronological age, have yielded mixed results.",Psychoneuroendocrinology
DNA methylation of IL-4 gene and the association with childhood trauma in panic disorder.,"Increasing evidence suggests that aberrations in the immune-inflammatory pathways contribute to the pathophysiology of panic disorder (PD). We aimed to investigate whether an aberrant DNA methylation of the inflammation-related genes in the development of PD, including CCL3, CRP, CSF2, CXCL8, IFNG, IL12B, IL1A, IL-4, IL-6, TNF. Then, the effect of childhood trauma(CT) on methylation levels of  inflammation-related genes and the severity of PD was also investigated. We compared the methylation levels of the inflammation-related genes between 113 patients with PD and 130 matched healthy controls using MethylTarget approach. In addition, the Hamilton Anxiety Rating Scale (HAMA), Panic Disorder Severity Scale (PDSS) and Childhood Trauma Questionnaire-28 item Short Form (CTQ-28) were respectively assessed to all subjects. The result found that the methylation levels of IL-4 gene was significantly higher in PD patients than controls. ROC results found that the IL-4 gene had a sensitivity of 52.3% and a specificity of 74.6%. The methylation levels of IL-4 gene was significantly positively related to the severity of panic and anxiety. Finally, the hypermethylation of CSF2, CXCL8 and IL-4 genes was significantly associated with higher CT.",Psychiatry research
PTSD is associated with increased DNA methylation across regions of HLA-DPB1 and SPATC1L.,"Posttraumatic stress disorder (PTSD) is characterized by intrusive thoughts, avoidance, negative alterations in cognitions and mood, and arousal symptoms that adversely affect mental and physical health. Recent evidence links changes in DNA methylation of CpG cites to PTSD. Since clusters of proximal CpGs share similar methylation signatures, identification of PTSD-associated differentially methylated regions (DMRs) may elucidate the pathways defining differential risk and resilience of PTSD. Here we aimed to identify epigenetic differences associated with PTSD. DNA methylation data profiled from blood samples using the MethylationEPIC BeadChip were used to perform a DMR analysis in 187 PTSD cases and 367 trauma-exposed controls from the Grady Trauma Project (GTP). DMRs were assessed with R package bumphunter. We identified two regions that associate with PTSD after multiple test correction. These regions were in the gene body of HLA-DPB1 and in the promoter of SPATC1L. The DMR in HLA-DPB1 was associated with PTSD in an independent cohort. Both DMRs included CpGs whose methylation associated with nearby sequence variation (meQTL) and that associated with expression of their respective genes (eQTM). This study supports an emerging literature linking PTSD risk to genetic and epigenetic variation in the HLA region.","Brain, behavior, and immunity"
DNA methylation from germline cells in veterans with PTSD.,"In this study we investigated genome-wide sperm DNA methylation patterns in trauma-exposed Vietnam veterans. At the genome-wide level, we identified 3 CpG sites associated with PTSD in sperm including two intergenic and one CpG within the CCDC88C gene. Of those associated with PTSD in sperm at a nominal level, 1868 CpGs were also associated with PTSD in peripheral blood (5.6% overlap) including the RORA, CRHR1 and DOCK2 genes that have been previously implicated in PTSD. A total of 10 CpG sites were significantly associated with a reported history of a diagnosed mental health condition in children and reached genome-wide significance. CpGs associated with a history of a reported mental health condition in children were also enriched (90% of tested genes) for genes previously reported to be resistant to demethylation, making them strong candidates for transgenerational inheritance. In conclusion, our findings identify a unique sperm-specific DNA methylation pattern that is associated with PTSD.",Journal of psychiatric research
Genomic Approaches to Posttraumatic Stress Disorder: The Psychiatric Genomic Consortium Initiative.,"Posttraumatic stress disorder (PTSD) after exposure to a traumatic event is a highly prevalent psychiatric disorder. Heritability estimates from twin studies as well as from recent molecular data (single nucleotide polymorphism-based heritability) indicate moderate to high heritability, yet robust genetic variants for PTSD have not yet been identified and the genetic architecture of this polygenic disorder remains largely unknown. To date, fewer than 10 large-scale genome-wide association studies of PTSD have been published, with findings that highlight the unique challenges for PTSD genomics, including a complex diagnostic entity with contingency of PTSD diagnosis on trauma exposure and the large genetic diversity of the study populations. The Psychiatric Genomics Consortium PTSD group has brought together more than 200 scientists with the goal to increase sample size for genome-wide association studies and other genomic analyses to sufficient numbers where robust discoveries of molecular signatures can be achieved. The sample currently includes more than 32,000 PTSD cases and 100,000 trauma-exposed control subjects, and collection is ongoing. The first results found a significant shared genetic risk of PTSD with other psychiatric disorders and sex-biased heritability estimates with higher heritability in female individuals compared with male individuals. This review describes the scope and current focus of the Psychiatric Genomics Consortium PTSD group and its expansion from the initial genome-wide association study group to nine working groups, including epigenetics, gene expression, imaging, and integrative systems biology. We further briefly outline recent findings and future directions of ""omics""-based studies of PTSD, with the ultimate goal of elucidating the molecular architecture of this complex disorder to improve prevention and intervention strategies.",Biological psychiatry
Patho-genetics of posttraumatic stress disorder.,"Clinical genetic studies propose a moderate genetic contribution to the pathogenesis of PTSD with a heritability of about 30-35%. The present brief review will give an overview of molecular genetic research in PTSD yielding support for specific vulnerability genes. Additionally, evidence for gene-environment (GxE) interactions between susceptibility genes of PTSD and traumatic experiences will be reported. Recent studies suggest a pivotal role of epigenetic mechanisms such as DNA methylation in mediating the impact of trauma in the pathogenesis of PTSD. Future approaches to further unravel the genetic underpinnings of PTSD might comprise genome-wide association studies (GWAS), the investigation of the genetic influence on intermediate phenotypes of PTSD (e.g., imaging genetics) as well as pharmaco- and psychotherapy-genetic studies. Genetic research in PTSD will be discussed with respect to its potential benefit regarding innovative and individually tailored therapeutic approaches in PTSD.",Psychiatria Danubina
Early-life trauma endophenotypes and brain circuit-gene expression relationships in functional neurological (conversion) disorder.,"Functional neurological (conversion) disorder (FND) is a neuropsychiatric condition whereby individuals present with sensorimotor symptoms incompatible with other neurological disorders. Early-life maltreatment (ELM) is a risk factor for developing FND, yet few studies have investigated brain network-trauma relationships in this population. In this neuroimaging-gene expression study, we used two graph theory approaches to elucidate ELM subtype effects on resting-state functional connectivity architecture in 30 patients with motor FND. Twenty-one individuals with comparable depression, anxiety, and ELM scores were used as psychiatric controls. Thereafter, we compared trauma endophenotypes in FND with regional differences in transcriptional gene expression as measured by the Allen Human Brain Atlas (AHBA). In FND patients only, we found that early-life physical abuse severity, and to a lesser extent physical neglect, correlated with corticolimbic weighted-degree functional connectivity. Connectivity profiles influenced by physical abuse occurred in limbic (amygdalar-hippocampal), paralimbic (cingulo-insular and ventromedial prefrontal), and cognitive control (ventrolateral prefrontal) areas, as well as in sensorimotor and visual cortices. These findings held adjusting for individual differences in depression/anxiety, PTSD, and motor phenotypes. In FND, physical abuse also correlated with amygdala and insula coupling to motor cortices. In exploratory analyses, physical abuse correlated connectivity maps overlapped with the AHBA spatial expression of three gene clusters: (i) neuronal morphogenesis and synaptic transmission genes in limbic/paralimbic areas; (ii) locomotory behavior and neuronal generation genes in left-lateralized structures; and (iii) nervous system development and cell motility genes in right-lateralized structures. These circuit-specific architectural profiles related to individual differences in childhood physical abuse burden advance our understanding of the pathophysiology of FND.",Molecular psychiatry
Can epigenetics shine a light on the biological pathways underlying major mental disorders?,"A significant proportion of the global burden of disease can be attributed to mental illness. Despite important advances in identifying risk factors for mental health conditions, the biological processing underlying causal pathways to disease onset remain poorly understood. This represents a limitation to implement effective prevention and the development of novel pharmacological treatments. Epigenetic mechanisms have emerged as mediators of environmental and genetic risk factors which might play a role in disease onset, including childhood adversity (CA) and cannabis use (CU). Particularly, human research exploring DNA methylation has provided new and promising insights into the role of biological pathways implicated in the aetio-pathogenesis of psychiatric conditions, including: monoaminergic (Serotonin and Dopamine), GABAergic, glutamatergic, neurogenesis, inflammatory and immune response and oxidative stress. While these epigenetic changes have been often studied as disease-specific, similarly to the investigation of environmental risk factors, they are often transdiagnostic. Therefore, we aim to review the existing literature on DNA methylation from human studies of psychiatric diseases (i) to identify epigenetic modifications mapping onto biological pathways either transdiagnostically or specifically related to psychiatric diseases such as Eating Disorders, Post-traumatic Stress Disorder, Bipolar and Psychotic Disorder, Depression, Autism Spectrum Disorder and Anxiety Disorder, and (ii) to investigate a convergence between some of these epigenetic modifications and the exposure to known risk factors for psychiatric disorders such as CA and CU, as well as to other epigenetic confounders in psychiatry research.",Psychological medicine
Intergenerational Transmission of DNA Methylation Signatures Associated with Early Life Stress.,"Early life stress in humans (i.e. maltreatment, violence exposure, loss of a loved one) and in rodents (i.e. disrupted attachment or nesting, electric shock, restraint, predator odor) occurs during critical steps of neural circuit formation. ELS in humans is associated with increased risk for developmental psychopathology, including anxious and depressive phenotypes. The biological mechanisms underlying these potentially persistent maladaptive changes involve long-term epigenetic modifications, which have been suggested to be potentially transmissible to subsequent generations. DNA methylation is an epigenetic mechanism that modifies gene expression patterns in response to environmental challenges and influences mutation rates. It remains to be seen whether a functionally relevant fraction of DNA methylation marks can escape genome-wide erasures that occur in primordial germ cells and after fertilization within the zygote. Early life-stress-triggered changes in epigenetic mediated transmission of acquired behavioral traits among humans have been assessed mainly by targeting genes involved in the hypothalamic-pituitary-adrenal (HPA) axis, such as NR3C1 and FKBP5. Recently, researchers examining epigenetic transmission have begun to apply genome-wide approaches. In humans, reduced representation bisulfite sequencing (RRBS) was performed on peripheral samples that were obtained from individuals who were prenatally exposed to the ""Dutch Hunger Winter"", resulting in two Differentially Methylated Regions (DMRs) in INSR and CPTIA genes that were functionally, biologically and technically validated, and significantly associated with birth weights and LDL cholesterol levels in offspring. In rodents, non-genomic intergenerational transmission of anxiety which was associated with differentially methylated enhancers that were putatively involved in lipid signaling and synaptic/neurotransmission in hippocampal granule cells, was discovered also using RRBS. Finally, transgenerational transmission of altered behaviors was associated with sperm-derived microRNAs produced by ELS male mice. The field of epigenetic transmission is just beginning to enter the epigenomic era by using genome-wide analyses. Such approaches remain of strong interest to human studies, first in order to help to assess the relevance of the previous targeted studies, and second to discover new important epigenetic modifications of potential clinical importance. New discoveries may help to assess how transmittable the negative impact of stress may be to offspring. The latter may open doors for future treatments and resilience-promoting interventions, as well as new approaches to treat the effects of childhood trauma before the onset of psychiatric disorder.",Current genomics
Understanding posttraumatic stress disorder: insights from the methylome.,"Genome-wide association studies (GWAS) have identified numerous disease-associated variants; however, these variants have a minor effect on disease and explain only a small amount of the heritability of complex disorders. The search for the missing heritability has shifted attention to rare variants, copy number variants, copy neutral variants and epigenetic modifications. The central role of epigenetics, and specifically DNA methylation, in disease susceptibility and progression has become more apparent in recent years. Epigenetic mechanisms facilitate the response to environmental changes and challenges by regulating gene expression. This makes the study of DNA methylation in psychiatric disorders such as posttraumatic stress disorder (PTSD) highly salient, as the environment plays such a vital role in disease aetiology. The epigenome is dynamic and can be modulated by numerous factors, including learning and memory, which are important in the context of PTSD. Numerous studies have shown the effects of early life events, such as maternal separation and traumas during adulthood, on DNA methylation patterns and subsequent gene expression profiles. Aberrations in adaptive DNA methylation contribute to disease susceptibility when an organism is unable to effectively respond to environmental demands. Epigenetic mechanisms are also involved in higher order brain functions. Dysregulation of methylation is associated with neurodevelopmental and neurodegenerative cognitive disorders, affective disorders, addictive behaviours and altered stress responses. A thorough understanding of how the environment, methylome and transcriptome interact and influence each other in the context of fear and anxiety is integral to our understanding and treatment of stress-related disorders such as PTSD.","Genes, brain, and behavior"
